{
  "id": "everyday#referral_9ab2daa0",
  "title_en": "General — Referral",
  "title_vi": "General — Chuyển tuyến",
  "text_en": "6. Updating the evidence The guideline will be updated five years after or a change in the published recommendation may publication. The WHO Steering Group will continue be warranted, respectively. Following publication and to follow the research developments in the mhGAP dissemination of the guideline, any concern about module areas, particularly those questions for which no validity of any recommendation would be promptly evidence was found and those that were supported by communicated to the guideline implementers in low-certainty evidence, where new recommendations addition to plans to update the recommendation. 114 References 1. Global burden of disease 2019: mental disorders 8. Dua T, Barbui C, Patel AA, Tablante EC, Thornicroft – level 2 cause [website]. Seattle: Institute for G, Saxena S; WHO's mhGAP guideline team. Health Metrics and Evaluations; 2021 (http://www. Discussion of the updated WHO recommendations healthdata.org/results/gbd_summaries/2019/ for mental, neurological, and substance use mental-disorders-level-2-cause, accessed 25 disorders. Lancet Psychiatry. 2016;3(11):1008–12 October 2023). (https://doi.org/10.1016/s2215-0366(16)30184-5). 2. Dua T, Barbui C, Clark N, Fleischmann A, Poznyak V, 9. mhGAP intervention guide for mental, van Ommeren M et al. Evidence-based guidelines neurological and substance use disorders in non- for mental, neurological, and substance use specialized health settings: mental health Gap disorders in low- and middle-income countries: Action Programme (mhGAP), version 2.0. Geneva: summary of WHO recommendations. PLoS Med. World Health Organization; 2016 (https://iris.who. 2011;8(11): e1001122 (https://doi.org/10.1371/ int/handle/10665/250239). journal.pmed.1001122). 10. WHO handbook for guideline development, 2nd 3. Intersectoral global action plan on epilepsy and edition. Geneva: World Health Organization; 2014 other",
  "gloss_vi": "6. updating the evidence the guideline will be updated five years after or a change in the published recommendation may publication.",
  "source": "Everyday Essentials",
  "url": "",
  "lang": "en",
  "axes": {
    "type": [
      "clinical"
    ],
    "condition": [
      "General"
    ],
    "clinical_section": [
      "referral",
      "psychoeducation"
    ],
    "life_topics": [],
    "advice_section": [],
    "audience": [],
    "risk_band": "low"
  },
  "index_text": "General — Referral General — Chuyển tuyến 6. Updating the evidence The guideline will be updated five years after or a change in the published recommendation may publication. The WHO Steering Group will continue be warranted, respectively. Following publication and to follow the research developments in the mhGAP dissemination of the guideline, any concern about module areas, particularly those questions for which no validity of any recommendation would be promptly evidence was found and those that were supported by communicated to the guideline implementers in low-certainty evidence, where new recommendations addition to plans to update the recommendation. 114 References 1. Global burden of disease 2019: mental disorders 8. Dua T, Barbui C, Patel AA, Tablante EC, Thornicroft – level 2 cause [website]. Seattle: Institute for G, Saxena S; WHO's mhGAP guideline team. Health Metrics and Evaluations; 2021 (http://www. Discussion of the updated WHO recommendations healthdata.org/results/gbd_summaries/2019/ for mental, neurological, and substance use mental-disorders-level-2-cause, accessed 25 disorders. Lancet Psychiatry. 2016;3(11):1008–12 October 2023). (https://doi.org/10.1016/s2215-0366(16)30184-5). 2. Dua T, Barbui C, Clark N, Fleischmann A, Poznyak V, 9. mhGAP intervention guide for mental, van Ommeren M et al. Evidence-based guidelines neurological and substance use disorders in non- for mental, neurological, and substance use specialized health settings: mental health Gap disorders in low- and middle-income countries: Action Programme (mhGAP), version 2.0. Geneva: summary of WHO recommendations. PLoS Med. World Health Organization; 2016 (https://iris.who. 2011;8(11): e1001122 (https://doi.org/10.1371/ int/handle/10665/250239). journal.pmed.1001122). 10. WHO handbook for guideline development, 2nd 3. Intersectoral global action plan on epilepsy and edition. Geneva: World Health Organization; 2014 other 6. updating the evidence the guideline will be updated five years after or a change in the published recommendation may publication."
}