{
  "id": "everyday#screening_cues_ab7a7ddb",
  "title_en": "General — Screening Cues",
  "title_vi": "General — Dấu hiệu sàng lọc",
  "text_en": "age groups suggests that there are no differences non-pharmacological interventions more broadly) in effect sizes for these interventions for older in this specific sub-population (e.g. people with adults (55–75 years), and older old adults (75 years dementia and comorbid depression, rather than and older) (107). Moreover, meta-analytic evidence individuals with depressive symptoms). suggests the effectiveness of such interventions for y Instead, recent study designs and systematic reviews people with other neurological conditions such as tend to evaluate the effectiveness of psychosocial Parkinson’s disease and multiple sclerosis (108). interventions more broadly, such as cognitive, 54 3. Recommendations DEM3. For people with dementia, are non-pharmacological interventions effective in improving their outcomes? Recommendation (update): 3.1 Physical activity interventions – namely physical exercise delivered 3–4 times per week for 30–45 minutes for more than 12 weeks – should be offered to people living with dementia. Strength of recommendation: Strong Certainty of evidence: High 3.2 Non-pharmacological interventions – namely CBT, cognitive stimulation therapy and cognitive training (in alphabetical order) – should be considered for people living with dementia. Strength of recommendation: Conditional Certainty of evidence: Low Justification function and depressive symptoms as well as y Evidence was extracted from 15 systematic reviews: everyday function, quality of life and overall Bahar-Fuchs et al., 2019 (109); Brims and Oliver, 2019 dementia rating/severity with small to large (110); Cafferata et al., 2021 (111); Kim et al., 2019 magnitude and overall low to moderate certainty. (112); Kim and Lee, 2019 (113); Lai et al., 2019 (114); – Cognitive behavioural therapy (CBT) showed Lin et al., 2021 (115); Lu et al., 2020 (116); Möhler et slightly positive effects on depression remission al., 2020 (117); Moreno-Morales et al., 2020 (118); and negligible effects on reduction of depressive Nagaoka et al., 2021 (119); Orgeta et al., 2022 (120); symptoms, as well as small effects on everyday Saragih et al., 2022 (121); Wang et al., 2022 (122); and function and quality of life (of moderate to low Zhou et al., 2022 (123). certainty, respectively). y Overall, non-pharmacological interventions for – Cognitive stimulation therapy produces small to people living with dementia produce small-to-large large effects on overall cognition and memory effects for critical outcomes, favouring interventions function with low certainty, as well as medium with the certainty of evidence ranging from very effects on overall dementia severity ratings with low to high. Most robust evidence exists for physical moderate certainty. activity, with physical exercise interventions – Cognitive training produces small to large effects showing small positive effects on cognitive function on individual cognitive domains, with effects and medium effects on everyday function with a potentially retained for up to 12 months with very high level of certainty. This was especially true for low to moderate certainty, as well as medium physical exercise delivered 3–4 times per week for effects on overall disease progression with 30–45 minutes for more than 12 weeks. moderate certainty. y In addition, the following non-pharmacological interventions produce positive effects on cognitive 55",
  "gloss_vi": "Age groups suggests that there are no differences non-pharmacological interventions more broadly) in effect sizes for these interventions for older in this specific sub-population (e.g. people with adults (55–75 years), ...",
  "source": "Everyday Essentials",
  "url": "",
  "lang": "en",
  "axes": {
    "type": [
      "clinical",
      "everyday"
    ],
    "condition": [
      "General"
    ],
    "clinical_section": [
      "screening_cues"
    ],
    "life_topics": [
      "study"
    ],
    "advice_section": [],
    "audience": [],
    "risk_band": "low"
  },
  "index_text": "General — Screening Cues General — Dấu hiệu sàng lọc age groups suggests that there are no differences non-pharmacological interventions more broadly) in effect sizes for these interventions for older in this specific sub-population (e.g. people with adults (55–75 years), and older old adults (75 years dementia and comorbid depression, rather than and older) (107). Moreover, meta-analytic evidence individuals with depressive symptoms). suggests the effectiveness of such interventions for y Instead, recent study designs and systematic reviews people with other neurological conditions such as tend to evaluate the effectiveness of psychosocial Parkinson’s disease and multiple sclerosis (108). interventions more broadly, such as cognitive, 54 3. Recommendations DEM3. For people with dementia, are non-pharmacological interventions effective in improving their outcomes? Recommendation (update): 3.1 Physical activity interventions – namely physical exercise delivered 3–4 times per week for 30–45 minutes for more than 12 weeks – should be offered to people living with dementia. Strength of recommendation: Strong Certainty of evidence: High 3.2 Non-pharmacological interventions – namely CBT, cognitive stimulation therapy and cognitive training (in alphabetical order) – should be considered for people living with dementia. Strength of recommendation: Conditional Certainty of evidence: Low Justification function and depressive symptoms as well as y Evidence was extracted from 15 systematic reviews: everyday function, quality of life and overall Bahar-Fuchs et al., 2019 (109); Brims and Oliver, 2019 dementia rating/severity with small to large (110); Cafferata et al., 2021 (111); Kim et al., 2019 magnitude and overall low to moderate certainty. (112); Kim and Lee, 2019 (113); Lai et al., 2019 (114); – Cognitive behavioural therapy (CBT) showed Lin et al., 2021 (115); Lu et al., 2020 (116); Möhler et slightly positive effects on depression remission al., 2020 (117); Moreno-Morales et al., 2020 (118); and negligible effects on reduction of depressive Nagaoka et al., 2021 (119); Orgeta et al., 2022 (120); symptoms, as well as small effects on everyday Saragih et al., 2022 (121); Wang et al., 2022 (122); and function and quality of life (of moderate to low Zhou et al., 2022 (123). certainty, respectively). y Overall, non-pharmacological interventions for – Cognitive stimulation therapy produces small to people living with dementia produce small-to-large large effects on overall cognition and memory effects for critical outcomes, favouring interventions function with low certainty, as well as medium with the certainty of evidence ranging from very effects on overall dementia severity ratings with low to high. Most robust evidence exists for physical moderate certainty. activity, with physical exercise interventions – Cognitive training produces small to large effects showing small positive effects on cognitive function on individual cognitive domains, with effects and medium effects on everyday function with a potentially retained for up to 12 months with very high level of certainty. This was especially true for low to moderate certainty, as well as medium physical exercise delivered 3–4 times per week for effects on overall disease progression with 30–45 minutes for more than 12 weeks. moderate certainty. y In addition, the following non-pharmacological interventions produce positive effects on cognitive 55 Age groups suggests that there are no differences non-pharmacological interventions more broadly) in effect sizes for these interventions for older in this specific sub-population (e.g. people with adults (55–75 years), ..."
}