{
  "id": "everyday#general_042775a3",
  "title_en": "General — General",
  "title_vi": "General — General",
  "text_en": "Contributors 815 Subgroup on neurodevelopmental disorders M. Elena Garralda, Chair Gillian Baird David H. Skuse Additional contributors Travis T. Threats Dorothy Bishop Subgroup on disruptive behaviour and dissocial disorders John E. Lochman, Chair Walter Matthys Jeffrey D. Burke Francisco R. de la Peña Spencer C. Evans Michael C. Roberts Lourdes Ezpeleta Salma Siddiqui Paula F. Fite Eric A. Youngstrom ICD-11 Working Group on the Classification of Schizophrenia and Other Primary Psychotic Disorders Wolfgang Gaebel, Chair Michael F. Green Jonathan Burns Assen Jablensky Peter Falkai Toshimasa Maruta Saeed Farooq Pichet Udomratn Silvana Galderisi Veronica Larach Walters Philippa Garety Jürgen Zielasek ICD-11 Working Group on the Classification of Mood and Anxiety Disorders Mario Maj, Chair David J. Miklowitz Laura Andrade Driss Moussaoui Jules Angst Frank Njenga José L. Ayuso-Mateos Eugene Paykel Carlos Berlanga Michael R. Phillips Subho Chakrabarti Katherine Shear Paul M. G. Emmelkamp Dan J. Stein Maria Luisa Figueria Stephen M. Strakowski Ellen Leibenluft ICD-11 Working Group on the Classification of Obsessive-Compulsive and Related Disorders and Impulse Control Disorders Dan J. Stein, Chair Y.C. Janardhan Reddy Murad Atmaca H. Blair Simpson Naomi A. Fineberg Per Hove Thomsen Leonardo F. Fontenelle Odile A. van den Heuvel Jon E. Grant David",
  "gloss_vi": "Contributors 815 subgroup on neurodevelopmental disorders m. elena garralda, chair gillian baird david h.",
  "source": "Everyday Essentials",
  "url": "",
  "lang": "en",
  "axes": {
    "type": [
      "everyday"
    ],
    "condition": [
      "General"
    ],
    "clinical_section": [],
    "life_topics": [
      "work"
    ],
    "advice_section": [],
    "audience": [],
    "risk_band": "low"
  },
  "index_text": "General — General General — General Contributors 815 Subgroup on neurodevelopmental disorders M. Elena Garralda, Chair Gillian Baird David H. Skuse Additional contributors Travis T. Threats Dorothy Bishop Subgroup on disruptive behaviour and dissocial disorders John E. Lochman, Chair Walter Matthys Jeffrey D. Burke Francisco R. de la Peña Spencer C. Evans Michael C. Roberts Lourdes Ezpeleta Salma Siddiqui Paula F. Fite Eric A. Youngstrom ICD-11 Working Group on the Classification of Schizophrenia and Other Primary Psychotic Disorders Wolfgang Gaebel, Chair Michael F. Green Jonathan Burns Assen Jablensky Peter Falkai Toshimasa Maruta Saeed Farooq Pichet Udomratn Silvana Galderisi Veronica Larach Walters Philippa Garety Jürgen Zielasek ICD-11 Working Group on the Classification of Mood and Anxiety Disorders Mario Maj, Chair David J. Miklowitz Laura Andrade Driss Moussaoui Jules Angst Frank Njenga José L. Ayuso-Mateos Eugene Paykel Carlos Berlanga Michael R. Phillips Subho Chakrabarti Katherine Shear Paul M. G. Emmelkamp Dan J. Stein Maria Luisa Figueria Stephen M. Strakowski Ellen Leibenluft ICD-11 Working Group on the Classification of Obsessive-Compulsive and Related Disorders and Impulse Control Disorders Dan J. Stein, Chair Y.C. Janardhan Reddy Murad Atmaca H. Blair Simpson Naomi A. Fineberg Per Hove Thomsen Leonardo F. Fontenelle Odile A. van den Heuvel Jon E. Grant David Contributors 815 subgroup on neurodevelopmental disorders m. elena garralda, chair gillian baird david h."
}