{
  "id": "everyday#psychoeducation_e5bef48c",
  "title_en": "General — Psychoeducation",
  "title_vi": "General — Giáo dục tâm lý",
  "text_en": "person has been abstinent from alcohol for 12 months or longer. Diagnostic requirements for disorders due to substance use | Substance dependence Disorders due to substance use or addictive behaviours 465 6C40.2Z Alcohol dependence, unspecified Course specifiers for substance dependence for substances other than alcohol For all psychoactive substance classes other than alcohol (see the list above and Table 6.13, p. 450), a specifier is used to further describe the pattern of substance use or remission in the context of substance dependence, using a fifth-character code. Unlike alcohol, separate codes for continuous and episodic current use are not provided. The x below corresponds to the fourth-character code indicating the substance class (1 for cannabis, 2 for synthetic cannabinoids and so on). 6C4x.20 Substance dependence, current use The individual exhibits current substance dependence, with episodic or continuous use of the substance within the past month. 6C4x.21 Substance dependence, early full remission After a diagnosis of substance dependence, and often following a treatment episode or other intervention (including self-help intervention), the individual has been abstinent from the substance during a period lasting between 1 and 12 months. 6C4x.22 Substance dependence, sustained partial remission After a diagnosis of substance dependence, and often following a treatment episode or other intervention (including self-help intervention), there is a significant reduction in substance use for more than 12 months, such that even though intermittent or continuous use has occurred during this period, the diagnostic requirements for dependence have not been met. 6C4x.23 Substance dependence, sustained full remission After a diagnosis of substance dependence, and often following a treatment episode or other intervention (including self-intervention), the person has been abstinent from the substance for 12 months or longer. 6C4x.2Z Substance dependence, unspecified Diagnostic requirements for disorders due to substance use | Substance dependence",
  "gloss_vi": "Person has been abstinent from alcohol for 12 months or longer. diagnostic requirements for disorders due to substance use | substance dependence disorders due to substance use or addictive behaviours 465 6c40.2z alcohol...",
  "source": "Everyday Essentials",
  "url": "",
  "lang": "en",
  "axes": {
    "type": [
      "clinical"
    ],
    "condition": [
      "General"
    ],
    "clinical_section": [
      "psychoeducation"
    ],
    "life_topics": [],
    "advice_section": [],
    "audience": [],
    "risk_band": "low"
  },
  "index_text": "General — Psychoeducation General — Giáo dục tâm lý person has been abstinent from alcohol for 12 months or longer. Diagnostic requirements for disorders due to substance use | Substance dependence Disorders due to substance use or addictive behaviours 465 6C40.2Z Alcohol dependence, unspecified Course specifiers for substance dependence for substances other than alcohol For all psychoactive substance classes other than alcohol (see the list above and Table 6.13, p. 450), a specifier is used to further describe the pattern of substance use or remission in the context of substance dependence, using a fifth-character code. Unlike alcohol, separate codes for continuous and episodic current use are not provided. The x below corresponds to the fourth-character code indicating the substance class (1 for cannabis, 2 for synthetic cannabinoids and so on). 6C4x.20 Substance dependence, current use The individual exhibits current substance dependence, with episodic or continuous use of the substance within the past month. 6C4x.21 Substance dependence, early full remission After a diagnosis of substance dependence, and often following a treatment episode or other intervention (including self-help intervention), the individual has been abstinent from the substance during a period lasting between 1 and 12 months. 6C4x.22 Substance dependence, sustained partial remission After a diagnosis of substance dependence, and often following a treatment episode or other intervention (including self-help intervention), there is a significant reduction in substance use for more than 12 months, such that even though intermittent or continuous use has occurred during this period, the diagnostic requirements for dependence have not been met. 6C4x.23 Substance dependence, sustained full remission After a diagnosis of substance dependence, and often following a treatment episode or other intervention (including self-intervention), the person has been abstinent from the substance for 12 months or longer. 6C4x.2Z Substance dependence, unspecified Diagnostic requirements for disorders due to substance use | Substance dependence Person has been abstinent from alcohol for 12 months or longer. diagnostic requirements for disorders due to substance use | substance dependence disorders due to substance use or addictive behaviours 465 6c40.2z alcohol..."
}