{
  "id": "everyday#referral_9d91346f",
  "title_en": "General — Referral",
  "title_vi": "General — Chuyển tuyến",
  "text_en": "3. Recommendations Recommendation (new): 3.6 Psychosocial interventions using cognitive learning techniques to enhance communication and social competencies should be considered for children and adolescents with neurodevelopmental disabilities. Strength of recommendation: Conditional Certainty of evidence: Low Justification y Cognitive interventions can be delivered y Evidence was extracted from one meta-analysis: Ahn as components of broader comprehensive and Hwang, 2018 (6 RCTs) (66). interventions targeting adaptive and life skills. y Despite a promising finding (d = 0.64; 95% CI: 0.40 y Child participants included in the review by Ahn to 0.87) for adaptive behaviour (functioning), the and Hwang (2018) were younger children; in five of primary finding had a low certainty of evidence (66). six studies, children were under the age of 7 at the beginning of treatment. y This certainty of evidence was related to the small number of studies included in the meta-analytic Research gaps synthesis (six studies) with small sample sizes, y The review by Ahn and Hwang (2018) was the only concerns with blinding of outcome assessors, and systematic review taking a transdiagnostic approach heterogeneity. Results of the review are consistent that could be identified. More efforts are needed to with other meta-analyses and primary studies in synthesize evidence on interventions to optimize this area. outcomes in children and young people with Remarks neurodevelopmental disabilities taking a functional approach. y Everyday functioning is a target of many interventions for individuals with Implementation considerations neurodevelopmental disabilities and is thus a y These interventions have been largely implemented critical domain to examine. It refers to the ways in in home- and clinic-based settings, by clinicians and which individuals function in everyday aspects of life trained specialists. and includes communication skills, socialization and y Caregivers are often involved in treatment, either as daily living skills. participants or as individuals trained to deliver the y Cognitive interventions are a heterogeneous group intervention strategies in the absence of the primary of treatments to stimulate and optimize cognitive intervention agent. processes, such as working memory, attention, executive functions, communication and social competences, often in a simultaneous and broad manner via computerized and adaptive cognitive exercises. They can be adapted to the child’s cognitive profile. 37 Mental Health Gap Action Programme (mhGAP) guideline for mental, neurological and substance use disorders Recommendation (new): 3.7 Structured physical exercise should be considered to improve development, including social and communication development, and functioning in children and adolescents with autism. Strength of recommendation: Conditional Certainty of evidence: Low Justification y More research is needed on digital and virtual y Evidence was",
  "gloss_vi": "3. recommendations recommendation (new): 3.6 psychosocial interventions using cognitive learning techniques to enhance giao tiếp and social competencies should be considered for children and adolescents with neurodevelop...",
  "source": "Everyday Essentials",
  "url": "",
  "lang": "en",
  "axes": {
    "type": [
      "clinical",
      "everyday"
    ],
    "condition": [
      "General"
    ],
    "clinical_section": [
      "referral"
    ],
    "life_topics": [
      "study",
      "work"
    ],
    "advice_section": [],
    "audience": [],
    "risk_band": "low"
  },
  "index_text": "General — Referral General — Chuyển tuyến 3. Recommendations Recommendation (new): 3.6 Psychosocial interventions using cognitive learning techniques to enhance communication and social competencies should be considered for children and adolescents with neurodevelopmental disabilities. Strength of recommendation: Conditional Certainty of evidence: Low Justification y Cognitive interventions can be delivered y Evidence was extracted from one meta-analysis: Ahn as components of broader comprehensive and Hwang, 2018 (6 RCTs) (66). interventions targeting adaptive and life skills. y Despite a promising finding (d = 0.64; 95% CI: 0.40 y Child participants included in the review by Ahn to 0.87) for adaptive behaviour (functioning), the and Hwang (2018) were younger children; in five of primary finding had a low certainty of evidence (66). six studies, children were under the age of 7 at the beginning of treatment. y This certainty of evidence was related to the small number of studies included in the meta-analytic Research gaps synthesis (six studies) with small sample sizes, y The review by Ahn and Hwang (2018) was the only concerns with blinding of outcome assessors, and systematic review taking a transdiagnostic approach heterogeneity. Results of the review are consistent that could be identified. More efforts are needed to with other meta-analyses and primary studies in synthesize evidence on interventions to optimize this area. outcomes in children and young people with Remarks neurodevelopmental disabilities taking a functional approach. y Everyday functioning is a target of many interventions for individuals with Implementation considerations neurodevelopmental disabilities and is thus a y These interventions have been largely implemented critical domain to examine. It refers to the ways in in home- and clinic-based settings, by clinicians and which individuals function in everyday aspects of life trained specialists. and includes communication skills, socialization and y Caregivers are often involved in treatment, either as daily living skills. participants or as individuals trained to deliver the y Cognitive interventions are a heterogeneous group intervention strategies in the absence of the primary of treatments to stimulate and optimize cognitive intervention agent. processes, such as working memory, attention, executive functions, communication and social competences, often in a simultaneous and broad manner via computerized and adaptive cognitive exercises. They can be adapted to the child’s cognitive profile. 37 Mental Health Gap Action Programme (mhGAP) guideline for mental, neurological and substance use disorders Recommendation (new): 3.7 Structured physical exercise should be considered to improve development, including social and communication development, and functioning in children and adolescents with autism. Strength of recommendation: Conditional Certainty of evidence: Low Justification y More research is needed on digital and virtual y Evidence was 3. recommendations recommendation (new): 3.6 psychosocial interventions using cognitive learning techniques to enhance giao tiếp and social competencies should be considered for children and adolescents with neurodevelop..."
}