{
  "id": "everyday#referral_5c78e4c3",
  "title_en": "General — Referral",
  "title_vi": "General — Chuyển tuyến",
  "text_en": "118 SUB 2 DISORDERS DUE TO SUBSTANCE USE Management SUB 2 Management PROTOCOL 1 Harmful Use » Provide psychoeducation and emphasize that the level/pattern of substance use is causing harm to health. » Explore the person’s motivations for substance use. Conduct motivational interviewing. (See BRIEF PSYCHOSOCIAL INTERVENTION – MOTIVATIONAL INTERVIEWING (2.2)). » Advise stopping the substance completely or consuming it at a non-harmful level, if one exists. Verbalise your intention to support the person to do this. Ask them if they are ready to make this change. » Explore STRATEGIES FOR REDUCING OR STOPPING USE (2.3) and STRATEGIES FOR REDUCING HARM (2.5). » Address food, housing, and employment needs. » Follow up » If the person is an adolescent or a woman of child-bearing age, pregnant, or breastfeeding, see SPECIAL POPULATIONS. PROTOCOL 2 Dependence IF THE PERSON IS DEPENDENT ON OPIOIDS: FOR ALL OTHER SUBSTANCES: » » Maintenance treatment is generally more effective than detoxification. Advise stopping the substance completely and verbalise your intention to support » the person in doing so. Ask them if they are ready to do this. Assess the severity of dependence and, if appropriate, provide or refer the person for » opioid agonist maintenance treatment, also known as opioid substitution therapy (OST), Explore STRATEGIES FOR REDUCING OR STOPPING USE and STRATEGIES FOR after detoxification. Go to PROTOCOL 5 (Opioid Agonist Maintenance Treatment). REDUCING HARM. » » In the remainder of cases arrange planned detoxification, if necessary. Consider referral to peer help groups or rehabilitation/residential therapeutic Go to PROTOCOL 4 (Opioid Withdrawal). communities, if available. » Address food, housing, and employment needs. IF THE PERSON IS DEPENDENT ON BENZODIAZEPINES: » Assess and treat any physical or mental health co-morbidity, ideally after 2-3 weeks of » Sudden cessation",
  "gloss_vi": "118 sub 2 disorders due to substance use management sub 2 management protocol 1 harmful use » provide giáo dục tâm lý and emphasize that the level/pattern of substance use is causing harm to health. » explore the person’...",
  "source": "Everyday Essentials",
  "url": "",
  "lang": "en",
  "axes": {
    "type": [
      "clinical"
    ],
    "condition": [
      "General"
    ],
    "clinical_section": [
      "referral",
      "psychoeducation"
    ],
    "life_topics": [],
    "advice_section": [],
    "audience": [],
    "risk_band": "low"
  },
  "index_text": "General — Referral General — Chuyển tuyến 118 SUB 2 DISORDERS DUE TO SUBSTANCE USE Management SUB 2 Management PROTOCOL 1 Harmful Use » Provide psychoeducation and emphasize that the level/pattern of substance use is causing harm to health. » Explore the person’s motivations for substance use. Conduct motivational interviewing. (See BRIEF PSYCHOSOCIAL INTERVENTION – MOTIVATIONAL INTERVIEWING (2.2)). » Advise stopping the substance completely or consuming it at a non-harmful level, if one exists. Verbalise your intention to support the person to do this. Ask them if they are ready to make this change. » Explore STRATEGIES FOR REDUCING OR STOPPING USE (2.3) and STRATEGIES FOR REDUCING HARM (2.5). » Address food, housing, and employment needs. » Follow up » If the person is an adolescent or a woman of child-bearing age, pregnant, or breastfeeding, see SPECIAL POPULATIONS. PROTOCOL 2 Dependence IF THE PERSON IS DEPENDENT ON OPIOIDS: FOR ALL OTHER SUBSTANCES: » » Maintenance treatment is generally more effective than detoxification. Advise stopping the substance completely and verbalise your intention to support » the person in doing so. Ask them if they are ready to do this. Assess the severity of dependence and, if appropriate, provide or refer the person for » opioid agonist maintenance treatment, also known as opioid substitution therapy (OST), Explore STRATEGIES FOR REDUCING OR STOPPING USE and STRATEGIES FOR after detoxification. Go to PROTOCOL 5 (Opioid Agonist Maintenance Treatment). REDUCING HARM. » » In the remainder of cases arrange planned detoxification, if necessary. Consider referral to peer help groups or rehabilitation/residential therapeutic Go to PROTOCOL 4 (Opioid Withdrawal). communities, if available. » Address food, housing, and employment needs. IF THE PERSON IS DEPENDENT ON BENZODIAZEPINES: » Assess and treat any physical or mental health co-morbidity, ideally after 2-3 weeks of » Sudden cessation 118 sub 2 disorders due to substance use management sub 2 management protocol 1 harmful use » provide giáo dục tâm lý and emphasize that the level/pattern of substance use is causing harm to health. » explore the person’..."
}