{
  "id": "everyday#screening_cues_7e6ee192",
  "title_en": "General — Screening Cues",
  "title_vi": "General — Dấu hiệu sàng lọc",
  "text_en": "Mood disorders 245 6A70.0 Single episode depressive disorder, mild • All diagnostic requirements for a mild depressive episode (see p. 216) are currently met. 6A70.1 Single episode depressive disorder, moderate, without psychotic symptoms • All diagnostic requirements for a moderate depressive episode (see p. 216) are currently met. • There are no delusions or hallucinations during the depressive episode. 6A70.2 Single episode depressive disorder, moderate, with psychotic symptoms • All diagnostic requirements for a moderate depressive episode (see p. 217) are currently met. • There are delusions or hallucinations during the depressive episode. 6A70.3 Single episode depressive disorder, severe, without psychotic symptoms • All diagnostic requirements for a severe depressive episode (see p. 217) are currently met. • There are no delusions or hallucinations during the depressive episode. 6A70.4 Single episode depressive disorder, severe, with psychotic symptoms • All diagnostic requirements for a severe depressive episode (see p. 217) are currently met. • There are delusions or hallucinations during the depressive episode. 6A70.5 Single episode depressive disorder, unspecified severity • All diagnostic requirements for a depressive episode (see p. 212) are currently met. • There is insufficient information to determine the severity of the depressive episode. 6A70.6 Single episode depressive disorder, currently in partial remission • The full diagnostic requirements for a depressive episode (see p. 212) are no longer met, but some significant depressive symptoms remain. Note: this category may also be used to designate the re-emergence of subthreshold depressive symptoms following an asymptomatic period. 6A70.7 Single episode depressive disorder, currently in full remission • There are currently no longer any significant depressive symptoms. Mood disorders | Single episode depressive disorder 246 Clinical",
  "gloss_vi": "Mood disorders 245 6a70.0 single episode depressive disorder, mild • all diagnostic requirements for a mild depressive episode (see p. 216) are currently met.",
  "source": "Everyday Essentials",
  "url": "",
  "lang": "en",
  "axes": {
    "type": [
      "clinical"
    ],
    "condition": [
      "General"
    ],
    "clinical_section": [
      "screening_cues"
    ],
    "life_topics": [],
    "advice_section": [],
    "audience": [],
    "risk_band": "low"
  },
  "index_text": "General — Screening Cues General — Dấu hiệu sàng lọc Mood disorders 245 6A70.0 Single episode depressive disorder, mild • All diagnostic requirements for a mild depressive episode (see p. 216) are currently met. 6A70.1 Single episode depressive disorder, moderate, without psychotic symptoms • All diagnostic requirements for a moderate depressive episode (see p. 216) are currently met. • There are no delusions or hallucinations during the depressive episode. 6A70.2 Single episode depressive disorder, moderate, with psychotic symptoms • All diagnostic requirements for a moderate depressive episode (see p. 217) are currently met. • There are delusions or hallucinations during the depressive episode. 6A70.3 Single episode depressive disorder, severe, without psychotic symptoms • All diagnostic requirements for a severe depressive episode (see p. 217) are currently met. • There are no delusions or hallucinations during the depressive episode. 6A70.4 Single episode depressive disorder, severe, with psychotic symptoms • All diagnostic requirements for a severe depressive episode (see p. 217) are currently met. • There are delusions or hallucinations during the depressive episode. 6A70.5 Single episode depressive disorder, unspecified severity • All diagnostic requirements for a depressive episode (see p. 212) are currently met. • There is insufficient information to determine the severity of the depressive episode. 6A70.6 Single episode depressive disorder, currently in partial remission • The full diagnostic requirements for a depressive episode (see p. 212) are no longer met, but some significant depressive symptoms remain. Note: this category may also be used to designate the re-emergence of subthreshold depressive symptoms following an asymptomatic period. 6A70.7 Single episode depressive disorder, currently in full remission • There are currently no longer any significant depressive symptoms. Mood disorders | Single episode depressive disorder 246 Clinical Mood disorders 245 6a70.0 single episode depressive disorder, mild • all diagnostic requirements for a mild depressive episode (see p. 216) are currently met."
}