{
  "id": "everyday#screening_cues_a3a8f04e",
  "title_en": "General — Screening Cues",
  "title_vi": "General — Dấu hiệu sàng lọc",
  "text_en": "Crosswalk from ICD-11 mental, behavioural and neurodevelopmental disorders to ICD-10 for clinician use 767 ICD-11 ICD-10 Notes 6B84 Pica F98.3 Pica of infancy and childhood Use F98.3 if the individual is less OR than 12 years of age; otherwise, use F50.8. F50.8 Other eating disorders 6B85 Rumination-regurgitation disorder F98.2 Feeding disorder of infancy and childhood Use F98.2 if the individual is less OR than 12 years of age; otherwise, use F50.8. F50.8 Other eating disorders 6B8Y Other specified feeding or eating disorder F50.8 Other eating disorders 6B8Z Feeding or eating disorder, unspecified F50.9 Eating disorder, unspecified Elimination disorders 6C00 Enuresis F98.0 Nonorganic enuresis 6C00.0 Nocturnal enuresis F98.0 Nonorganic enuresis 6C00.1 Diurnal enuresis F98.0 Nonorganic enuresis 6C00.2 Nocturnal and diurnal enuresis F98.0 Nonorganic enuresis 6C00.Z Enuresis, unspecified F98.0 Nonorganic enuresis 6C01 Encopresis F98.1 Nonorganic encopresis 6C01.0 Encopresis with constipation or overflow F98.1 Nonorganic encopresis incontinence 6C01.1 Encopresis without constipation or overflow F98.1 Nonorganic encopresis incontinence 6C01.Z Encopresis, unspecified F98.1 Nonorganic encopresis 6C0Z Elimination disorder, unspecified F98.1 Nonorganic encopresis Disorders of bodily distress or bodily experience 6C20 Bodily distress disorder F45.9 Somatoform disorder, unspecified 6C20.0 Mild bodily distress disorder F45.4 Persistent somatoform pain disorder Use F45.4 if the primary symptom is pain. OR F45.9 Somatoform disorder, unspecified 6C20.1 Moderate bodily distress disorder F45.4 Persistent somatoform pain disorder Use F45.4 if the primary symptom is pain. OR F45.9 Somatoform disorder, unspecified 6C20.2 Severe bodily distress disorder F45.0 Somatization disorder Use F45.4 if the primary symptom is pain. OR F45.4 Persistent somatoform pain disorder Use F45.0 if there is OR a history of multiple and variable bodily symptoms. F45.9 Somatoform disorder, unspecified 6C20.Z Bodily distress disorder, unspecified F45.9 Somatoform disorder, unspecified 6C21 Body integrity dysphoria F99 Unspecified mental disorder 768 Clinical Descriptions and Diagnostic Requirements for ICD-11 Mental, Behavioural or Neurodevelopmental Disorders ICD-11 ICD-10 Notes 6C2Y Other specified disorder of bodily distress or F99 Unspecified mental disorder bodily experience No 4-character code available",
  "gloss_vi": "Crosswalk from icd-11 mental, behavioural and neurodevelopmental disorders to icd-10 for clinician use 767 icd-11 icd-10 notes 6b84 pica f98.3 pica of infancy and childhood use f98.3 if the individual is less or than 12 ...",
  "source": "Everyday Essentials",
  "url": "",
  "lang": "en",
  "axes": {
    "type": [
      "clinical",
      "everyday"
    ],
    "condition": [
      "General"
    ],
    "clinical_section": [
      "screening_cues"
    ],
    "life_topics": [
      "stress"
    ],
    "advice_section": [],
    "audience": [],
    "risk_band": "low"
  },
  "index_text": "General — Screening Cues General — Dấu hiệu sàng lọc Crosswalk from ICD-11 mental, behavioural and neurodevelopmental disorders to ICD-10 for clinician use 767 ICD-11 ICD-10 Notes 6B84 Pica F98.3 Pica of infancy and childhood Use F98.3 if the individual is less OR than 12 years of age; otherwise, use F50.8. F50.8 Other eating disorders 6B85 Rumination-regurgitation disorder F98.2 Feeding disorder of infancy and childhood Use F98.2 if the individual is less OR than 12 years of age; otherwise, use F50.8. F50.8 Other eating disorders 6B8Y Other specified feeding or eating disorder F50.8 Other eating disorders 6B8Z Feeding or eating disorder, unspecified F50.9 Eating disorder, unspecified Elimination disorders 6C00 Enuresis F98.0 Nonorganic enuresis 6C00.0 Nocturnal enuresis F98.0 Nonorganic enuresis 6C00.1 Diurnal enuresis F98.0 Nonorganic enuresis 6C00.2 Nocturnal and diurnal enuresis F98.0 Nonorganic enuresis 6C00.Z Enuresis, unspecified F98.0 Nonorganic enuresis 6C01 Encopresis F98.1 Nonorganic encopresis 6C01.0 Encopresis with constipation or overflow F98.1 Nonorganic encopresis incontinence 6C01.1 Encopresis without constipation or overflow F98.1 Nonorganic encopresis incontinence 6C01.Z Encopresis, unspecified F98.1 Nonorganic encopresis 6C0Z Elimination disorder, unspecified F98.1 Nonorganic encopresis Disorders of bodily distress or bodily experience 6C20 Bodily distress disorder F45.9 Somatoform disorder, unspecified 6C20.0 Mild bodily distress disorder F45.4 Persistent somatoform pain disorder Use F45.4 if the primary symptom is pain. OR F45.9 Somatoform disorder, unspecified 6C20.1 Moderate bodily distress disorder F45.4 Persistent somatoform pain disorder Use F45.4 if the primary symptom is pain. OR F45.9 Somatoform disorder, unspecified 6C20.2 Severe bodily distress disorder F45.0 Somatization disorder Use F45.4 if the primary symptom is pain. OR F45.4 Persistent somatoform pain disorder Use F45.0 if there is OR a history of multiple and variable bodily symptoms. F45.9 Somatoform disorder, unspecified 6C20.Z Bodily distress disorder, unspecified F45.9 Somatoform disorder, unspecified 6C21 Body integrity dysphoria F99 Unspecified mental disorder 768 Clinical Descriptions and Diagnostic Requirements for ICD-11 Mental, Behavioural or Neurodevelopmental Disorders ICD-11 ICD-10 Notes 6C2Y Other specified disorder of bodily distress or F99 Unspecified mental disorder bodily experience No 4-character code available Crosswalk from icd-11 mental, behavioural and neurodevelopmental disorders to icd-10 for clinician use 767 icd-11 icd-10 notes 6b84 pica f98.3 pica of infancy and childhood use f98.3 if the individual is less or than 12 ..."
}