{
  "id": "everyday#risk_safety_dd818f38",
  "title_en": "General — Risk Safety",
  "title_vi": "General — Nguy cơ An toàn",
  "text_en": "side-effects y Most weight gain was produced by clozapine, in adolescents. quetiapine and olanzapine. Implementation considerations y For prolactin increase, aripiprazole and asenapine showed the lowest prolactin increase. Quetiapine, y Only a few antipsychotics are officially licensed paliperidone, olanzapine, haloperidol and for children and adolescents which should be risperidone showed significantly higher prolactin considered in medicine choice, taking into account increase than placebo. Risperidone and haloperidol the country and context. showed the largest prolactin increase compared y Antipsychotic medicine should be considered for with the placebo. adolescents with psychotic disorders only under y Concerning the outcome sedation, most medicines supervision of a mental health specialist. produced this outcome. Risperidone, aripiprazole, y Adolescents are more susceptible to side-effects haloperidol, olanzapine, loxapine, paliperidone, from antipsychotic medicines than adults. In asenapine and clozapine led to significantly more turn, during the clinical decision-making process, sedation than placebo. adolescents living with psychosis should be made y The use of anticholinergic medicine was significantly aware of benefits and side-effects so that they higher for paliperidone compared with placebo. are able to make informed choices regarding the treatment plan. Additionally, carer preference Remarks should be taken into consideration. y The medicines included in the recommendation y Furthermore, given the higher susceptibility of correspond to the WHO EML (13) and are listed in adolescents to side-effects, the medicines approved alphabetical order. in a given country should be carefully considered y Clozapine should only be offered where lab tests before formulating a treatment plan. are available to monitor white blood cell count, and under a mental health specialist’s supervision. PSY6. Is psychotropic medicine effective and safe for adolescents with bipolar disorder? Recommendation (update): Psychotropic medicines (antipsychotic medicines, namely aripiprazole, olanzapine, quetiapine, risperidone; and mood stabilizers, namely lithium) should be considered under specialist supervision for adolescents with bipolar disorder (current episode manic), carefully balancing effectiveness, side-effects and individual preference. Strength of recommendation: Conditional Certainty of evidence: Very low Justification trials in children and adolescents with bipolar y Evidence was extracted from two systematic reviews: disorder manic episode) (201). DelBello et al., 2022 (4 RCTs in an NMA of efficacy and y Few antipsychotics/mood stabilizers have been safety of second-generation antipsychotic medicines tested in children and adolescents. The medicines in youths with bipolar depression) (200); and Ciray mentioned above were the only efficacious ones. et al., 2020 (11 placebo-controlled pharmacological 94",
  "gloss_vi": "Side-effects y most weight gain was produced by clozapine, in adolescents. quetiapine and olanzapine.",
  "source": "Everyday Essentials",
  "url": "",
  "lang": "en",
  "axes": {
    "type": [
      "clinical"
    ],
    "condition": [
      "General"
    ],
    "clinical_section": [
      "risk_safety",
      "referral"
    ],
    "life_topics": [],
    "advice_section": [],
    "audience": [],
    "risk_band": "low"
  },
  "index_text": "General — Risk Safety General — Nguy cơ An toàn side-effects y Most weight gain was produced by clozapine, in adolescents. quetiapine and olanzapine. Implementation considerations y For prolactin increase, aripiprazole and asenapine showed the lowest prolactin increase. Quetiapine, y Only a few antipsychotics are officially licensed paliperidone, olanzapine, haloperidol and for children and adolescents which should be risperidone showed significantly higher prolactin considered in medicine choice, taking into account increase than placebo. Risperidone and haloperidol the country and context. showed the largest prolactin increase compared y Antipsychotic medicine should be considered for with the placebo. adolescents with psychotic disorders only under y Concerning the outcome sedation, most medicines supervision of a mental health specialist. produced this outcome. Risperidone, aripiprazole, y Adolescents are more susceptible to side-effects haloperidol, olanzapine, loxapine, paliperidone, from antipsychotic medicines than adults. In asenapine and clozapine led to significantly more turn, during the clinical decision-making process, sedation than placebo. adolescents living with psychosis should be made y The use of anticholinergic medicine was significantly aware of benefits and side-effects so that they higher for paliperidone compared with placebo. are able to make informed choices regarding the treatment plan. Additionally, carer preference Remarks should be taken into consideration. y The medicines included in the recommendation y Furthermore, given the higher susceptibility of correspond to the WHO EML (13) and are listed in adolescents to side-effects, the medicines approved alphabetical order. in a given country should be carefully considered y Clozapine should only be offered where lab tests before formulating a treatment plan. are available to monitor white blood cell count, and under a mental health specialist’s supervision. PSY6. Is psychotropic medicine effective and safe for adolescents with bipolar disorder? Recommendation (update): Psychotropic medicines (antipsychotic medicines, namely aripiprazole, olanzapine, quetiapine, risperidone; and mood stabilizers, namely lithium) should be considered under specialist supervision for adolescents with bipolar disorder (current episode manic), carefully balancing effectiveness, side-effects and individual preference. Strength of recommendation: Conditional Certainty of evidence: Very low Justification trials in children and adolescents with bipolar y Evidence was extracted from two systematic reviews: disorder manic episode) (201). DelBello et al., 2022 (4 RCTs in an NMA of efficacy and y Few antipsychotics/mood stabilizers have been safety of second-generation antipsychotic medicines tested in children and adolescents. The medicines in youths with bipolar depression) (200); and Ciray mentioned above were the only efficacious ones. et al., 2020 (11 placebo-controlled pharmacological 94 Side-effects y most weight gain was produced by clozapine, in adolescents. quetiapine and olanzapine."
}