{
  "id": "everyday#screening_cues_52bc8d6f",
  "title_en": "General — Screening Cues",
  "title_vi": "General — Dấu hiệu sàng lọc",
  "text_en": "362 Clinical Descriptions and Diagnostic Requirements for ICD-11 Mental, Behavioural or Neurodevelopmental Disorders sexual violence, terrorism; assault, acute life-threatening illness (e.g. a heart attack); witnessing the threatened or actual injury or death of others in a sudden, unexpected, or violent manner; and learning about the sudden, unexpected or violent death of a loved one. • There is a response to the stressor that is considered to be normal, given the severity of the stressor. The response to the stressor may include transient emotional, somatic, cognitive or behavioural symptoms, such as being in a daze, confusion, sadness, anxiety, anger, despair, overactivity, inactivity, social withdrawal, amnesia, depersonalization, derealization or stupor. Autonomic signs of anxiety (e.g. tachycardia, sweating, flushing) are common, and may be the presenting feature. • Symptoms typically appear within hours to days following the stressful event, and usually begin to subside within a few days after the event or following removal from the threatening situation, when this is possible. In cases where the stressor is ongoing or removal is not possible, symptoms may persist, but are usually greatly reduced within approximately 1 month as the person adapts to the changed situation. Additional clinical features • Acute stress reaction in help-seeking individuals is usually, but not necessarily, accompanied by substantial subjective distress and/or interference with personal functioning. Developmental presentations • In children, responses to stressful events can include somatic symptoms (e.g. stomach pains or headaches),",
  "gloss_vi": "362 clinical descriptions and diagnostic requirements for icd-11 mental, behavioural or neurodevelopmental disorders sexual violence, terrorism; assault, acute life-threatening illness (e.g. a heart attack); witnessing t...",
  "source": "Everyday Essentials",
  "url": "",
  "lang": "en",
  "axes": {
    "type": [
      "clinical",
      "everyday"
    ],
    "condition": [
      "General"
    ],
    "clinical_section": [
      "screening_cues"
    ],
    "life_topics": [
      "stress"
    ],
    "advice_section": [],
    "audience": [],
    "risk_band": "low"
  },
  "index_text": "General — Screening Cues General — Dấu hiệu sàng lọc 362 Clinical Descriptions and Diagnostic Requirements for ICD-11 Mental, Behavioural or Neurodevelopmental Disorders sexual violence, terrorism; assault, acute life-threatening illness (e.g. a heart attack); witnessing the threatened or actual injury or death of others in a sudden, unexpected, or violent manner; and learning about the sudden, unexpected or violent death of a loved one. • There is a response to the stressor that is considered to be normal, given the severity of the stressor. The response to the stressor may include transient emotional, somatic, cognitive or behavioural symptoms, such as being in a daze, confusion, sadness, anxiety, anger, despair, overactivity, inactivity, social withdrawal, amnesia, depersonalization, derealization or stupor. Autonomic signs of anxiety (e.g. tachycardia, sweating, flushing) are common, and may be the presenting feature. • Symptoms typically appear within hours to days following the stressful event, and usually begin to subside within a few days after the event or following removal from the threatening situation, when this is possible. In cases where the stressor is ongoing or removal is not possible, symptoms may persist, but are usually greatly reduced within approximately 1 month as the person adapts to the changed situation. Additional clinical features • Acute stress reaction in help-seeking individuals is usually, but not necessarily, accompanied by substantial subjective distress and/or interference with personal functioning. Developmental presentations • In children, responses to stressful events can include somatic symptoms (e.g. stomach pains or headaches), 362 clinical descriptions and diagnostic requirements for icd-11 mental, behavioural or neurodevelopmental disorders sexual violence, terrorism; assault, acute life-threatening illness (e.g. a heart attack); witnessing t..."
}