{
  "id": "everyday#screening_cues_6c9a57dd",
  "title_en": "General — Screening Cues",
  "title_vi": "General — Dấu hiệu sàng lọc",
  "text_en": "stimulus (e.g. auditory or visual hallucinations). The person may or may not have insight into the unreal nature of the perception; Cognition = symptoms, signs and clinical findings indicative of a disturbance in mental abilities and processes related to attention, memory, judgment, reasoning, problem solving, decision making, comprehension and the integration of these functions. III. Manage MNS Conditions Once the assessment is conducted, follow the management algorithm in mhGAP-IG to manage the MNS disorder. Key steps in management are found in the box below. MANAGEMENT STEPS FOR MNS CONDITIONS Many MNS conditions are chronic and require long-term monitoring and follow-up. Managing a MNS disorder over time involves the following steps. 1 Develop a treatment plan in collaboration with 4 Refer to specialists or hospital when indicated the person and their carer. and available. 5 Ensure that appropriate plan for follow-up is in place. CLINICAL TIP: Written treatment plan should cover: 6 Work together with carer and families – Pharmacological interventions (if any) – Psychosocial interventions in supporting the person with the MNS disorder. – Referrals – Follow-up plan 7 Foster strong links with employment, education, – Management of any concurrent physical and/or other MNS conditions social services (including housing) and other relevant sectors. 2 Always offer psychosocial interventions for the person 8 Modify treatment plans for special populations. and their carers. 3 Treat the MNS disorder using pharmacological interventions when indicated. ESSENTIAL CARE AND PRACTICE 11",
  "gloss_vi": "Stimulus (e.g. auditory or visual hallucinations).",
  "source": "Everyday Essentials",
  "url": "",
  "lang": "en",
  "axes": {
    "type": [
      "clinical",
      "everyday"
    ],
    "condition": [
      "General"
    ],
    "clinical_section": [
      "screening_cues",
      "referral",
      "psychoeducation"
    ],
    "life_topics": [
      "work"
    ],
    "advice_section": [],
    "audience": [],
    "risk_band": "low"
  },
  "index_text": "General — Screening Cues General — Dấu hiệu sàng lọc stimulus (e.g. auditory or visual hallucinations). The person may or may not have insight into the unreal nature of the perception; Cognition = symptoms, signs and clinical findings indicative of a disturbance in mental abilities and processes related to attention, memory, judgment, reasoning, problem solving, decision making, comprehension and the integration of these functions. III. Manage MNS Conditions Once the assessment is conducted, follow the management algorithm in mhGAP-IG to manage the MNS disorder. Key steps in management are found in the box below. MANAGEMENT STEPS FOR MNS CONDITIONS Many MNS conditions are chronic and require long-term monitoring and follow-up. Managing a MNS disorder over time involves the following steps. 1 Develop a treatment plan in collaboration with 4 Refer to specialists or hospital when indicated the person and their carer. and available. 5 Ensure that appropriate plan for follow-up is in place. CLINICAL TIP: Written treatment plan should cover: 6 Work together with carer and families – Pharmacological interventions (if any) – Psychosocial interventions in supporting the person with the MNS disorder. – Referrals – Follow-up plan 7 Foster strong links with employment, education, – Management of any concurrent physical and/or other MNS conditions social services (including housing) and other relevant sectors. 2 Always offer psychosocial interventions for the person 8 Modify treatment plans for special populations. and their carers. 3 Treat the MNS disorder using pharmacological interventions when indicated. ESSENTIAL CARE AND PRACTICE 11 Stimulus (e.g. auditory or visual hallucinations)."
}