{
  "id": "everyday#screening_cues_b6e42bec",
  "title_en": "General — Screening Cues",
  "title_vi": "General — Dấu hiệu sàng lọc",
  "text_en": "should be as frequent as possible, even daily, until acute symptoms 1 respond to treatment. Once symptoms respond, monthly to ASSESS FOR IMPROVEMENT quarterly follow-up is recommended. » For persons not currently in manic or depressed states, follow-up at Is the person improving? least every three months. Consider » more frequent follow up when Follow-up as needed until symptoms needed. Monitor closely for relapse. have subsided. » Continue maintenance medications for at least 2 years. SKIP to STEP 1 20 Is the person taking medication? » If appropriate, initiate medication. » Check dosing and side effects. Go to Table 1 or Table 3. CLINICAL TIP » If switching to another Ensure that person has been on a typical effective dose of medication, begin that medi- medication for a minimum of four to six weeks. cation first and treat with » » If on typical effective dose of medications for four to six weeks Review psychosocial interventions. both medications for 2 weeks with no improvement, consider switching medication. See Table 3. » before tapering off the first Evaluate for medical problems. » medication. If response is still poor, consult a specialist.",
  "gloss_vi": "Should be as frequent as possible, even daily, until acute symptoms 1 respond to treatment. once symptoms respond, monthly to assess for improvement quarterly follow-up is recommended.",
  "source": "Everyday Essentials",
  "url": "",
  "lang": "en",
  "axes": {
    "type": [
      "clinical"
    ],
    "condition": [
      "General"
    ],
    "clinical_section": [
      "screening_cues",
      "referral"
    ],
    "life_topics": [],
    "advice_section": [],
    "audience": [],
    "risk_band": "low"
  },
  "index_text": "General — Screening Cues General — Dấu hiệu sàng lọc should be as frequent as possible, even daily, until acute symptoms 1 respond to treatment. Once symptoms respond, monthly to ASSESS FOR IMPROVEMENT quarterly follow-up is recommended. » For persons not currently in manic or depressed states, follow-up at Is the person improving? least every three months. Consider » more frequent follow up when Follow-up as needed until symptoms needed. Monitor closely for relapse. have subsided. » Continue maintenance medications for at least 2 years. SKIP to STEP 1 20 Is the person taking medication? » If appropriate, initiate medication. » Check dosing and side effects. Go to Table 1 or Table 3. CLINICAL TIP » If switching to another Ensure that person has been on a typical effective dose of medication, begin that medi- medication for a minimum of four to six weeks. cation first and treat with » » If on typical effective dose of medications for four to six weeks Review psychosocial interventions. both medications for 2 weeks with no improvement, consider switching medication. See Table 3. » before tapering off the first Evaluate for medical problems. » medication. If response is still poor, consult a specialist. Should be as frequent as possible, even daily, until acute symptoms 1 respond to treatment. once symptoms respond, monthly to assess for improvement quarterly follow-up is recommended."
}