{
  "id": "everyday#screening_cues_c7a466a8",
  "title_en": "General — Screening Cues",
  "title_vi": "General — Dấu hiệu sàng lọc",
  "text_en": "the situation anyone who may be a – Consult a specialist. trigger for the aggression. if the person remains agitated, recheck oxygen saturation, If all possibilities have been exhausted and the person vital signs and glucose. Consider pain. Refer to hospital. is still aggressive, it may be necessary to use medication Once agitation subsides, refer to the master chart (MC) and (if available) to prevent injury. select relevant modules for assessment. Special Populations: Consult a specialist for treatment. PSYCHOSES 45 46 PSY 3 PSYCHOSES Follow -up PSY 3 Follow-up RECOMMENDATIONS ON FREQUENCY OF CONTACT PSYCHOSIS 1 » Initial follow-up should be as frequent as possible, even daily, ASSESS FOR IMPROVEMENT until acute symptoms respond to treatment. » Regular follow-up is needed. Once Is the person improving? symptoms respond, monthly to quarterly follow-up is recommended (based on clinical need and feasibility factors such as staff availability, distance from clinic, etc.) » Continue with treatment plan. » Decrease frequency of follow-up once symptoms have subsided. » Follow-up as needed. Is the person taking medication? SKIP to STEP 120 » START ANTIPSYCHOTIC MEDICATIONS (Go to Table 1). » Maintain a high frequency of contact until symptoms start to respond to treatment. » Ensure that person has been on a typical » effective dose for minimum of 4-6 weeks. Involve the person and carers in treatment plan changes and decisions. » Maintain a high frequency of contact until symptoms start to respond to treatment. » Involve the person and carers in treatment plan changes and decisions.",
  "gloss_vi": "The situation anyone who may be a – consult a specialist. trigger for the aggression.",
  "source": "Everyday Essentials",
  "url": "",
  "lang": "en",
  "axes": {
    "type": [
      "clinical"
    ],
    "condition": [
      "General"
    ],
    "clinical_section": [
      "screening_cues",
      "referral"
    ],
    "life_topics": [],
    "advice_section": [],
    "audience": [],
    "risk_band": "low"
  },
  "index_text": "General — Screening Cues General — Dấu hiệu sàng lọc the situation anyone who may be a – Consult a specialist. trigger for the aggression. if the person remains agitated, recheck oxygen saturation, If all possibilities have been exhausted and the person vital signs and glucose. Consider pain. Refer to hospital. is still aggressive, it may be necessary to use medication Once agitation subsides, refer to the master chart (MC) and (if available) to prevent injury. select relevant modules for assessment. Special Populations: Consult a specialist for treatment. PSYCHOSES 45 46 PSY 3 PSYCHOSES Follow -up PSY 3 Follow-up RECOMMENDATIONS ON FREQUENCY OF CONTACT PSYCHOSIS 1 » Initial follow-up should be as frequent as possible, even daily, ASSESS FOR IMPROVEMENT until acute symptoms respond to treatment. » Regular follow-up is needed. Once Is the person improving? symptoms respond, monthly to quarterly follow-up is recommended (based on clinical need and feasibility factors such as staff availability, distance from clinic, etc.) » Continue with treatment plan. » Decrease frequency of follow-up once symptoms have subsided. » Follow-up as needed. Is the person taking medication? SKIP to STEP 120 » START ANTIPSYCHOTIC MEDICATIONS (Go to Table 1). » Maintain a high frequency of contact until symptoms start to respond to treatment. » Ensure that person has been on a typical » effective dose for minimum of 4-6 weeks. Involve the person and carers in treatment plan changes and decisions. » Maintain a high frequency of contact until symptoms start to respond to treatment. » Involve the person and carers in treatment plan changes and decisions. The situation anyone who may be a – consult a specialist. trigger for the aggression."
}