{
  "id": "everyday#referral_ed618eed",
  "title_en": "General — Referral",
  "title_vi": "General — Chuyển tuyến",
  "text_en": "16 Clinical Descriptions and Diagnostic Requirements for ICD-11 Mental, Behavioural or Neurodevelopmental Disorders References2 1. World Health Assembly Update, 25 May 2019. 14. International statistical classification of diseases Geneva: World Health Organization; 2019 and related health problems, 10th revision. (https://www.who.int/news/item/25-05-2019- Geneva: World Health Organization; 1992. world-health-assembly-update). 15. The ICD-10 classification of mental and 2. ICD-11 Reference Guide. Geneva: World Health behavioural disorders: clinical descriptions and diagnostic guidelines. Geneva: World Health Organization; 2019 (https://icdcdn.who.int/ Organization; 1992. icd11referenceguide/en/html/index.html). 16. First MB, Reed GM, Hyman SE, Saxena S. The 3. Basic documents, 49th edition. Geneva: World development of the ICD-11 clinical descriptions Health Organization; 2020 (https://apps.who. and diagnostic guidelines for mental and int/iris/handle/10665/339554). behavioural disorders. World Psychiatry. 4. International Statistical Classification of 2015;14(1):82–90. doi:10.1002/wps.20189. Diseases and Related Health Problems (ICD). 17. Keeley JW, Reed GM, Roberts MC, Evans SC, Geneva: World Health Organization; 2022 Medina-Mora ME, Robles R et al. Developing (https://www.who.int/standards/classifications/ a science of clinical utility in diagnostic classification-of-diseases). classification systems field study strategies for ICD-11 mental and behavioral disorders. 5. International Advisory Group for the Revision Am Psychol. 2016;71(1):3–16. doi:10.1037/ of ICD-10 Mental and Behavioural Disorders. a0039972. A conceptual framework for the revision of the 18. Reed GM, Sharan P, Rebello TJ, Keeley JW, ICD-10 classification of mental and behavioural Medina-Mora ME, Gureje O et al. The ICD- disorders. World Psychiatry. 2011;10:86–92. 11 developmental field study of reliability of doi:10.1002/j.2051-5545.2011.tb00022.x. diagnoses of high-burden mental disorders: 6. Reed GM, First MB, Kogan CS, Hyman SE, results among adult patients in mental health Gureje O, Gaebel W et al. Innovations and settings of 13 countries. World Psychiatry. changes in the ICD-11 classification of mental, 2018;17(2):174–86. doi:10.1002/wps.20524. behavioural and neurodevelopmental disorders. 19. Reed GM, Keeley JW, Rebello TJ, First MB, World Psychiatry. 2019;18:3–19. doi:10.1002/ Gureje O, Ayuso-Mateos JL et al. Clinical wps.20611. utility of ICD-11 diagnostic guidelines for high-burden mental disorders: results from 7. Rehm J, Shield KD. Global burden of disease mental health settings in 13 countries. World and the impact of mental and addictive Psychiatry. 2018;17(3):306–15. doi:10.1002/ disorders. Curr Psychiatry Rep. 2019;21(2):10. wps.20581. doi:10.1007/s11920-019-0997-0. 20. Gaebel W. Status of psychotic disorders in 8. ICD-11 for Mortality and Morbidity Statistics ICD-11. Schizophr Bull. 2012;38(5):895–8. (ICD-11 MMS) [website]. Geneva: World doi:10.1093/schbul/sbs104. Health Organization; 2023 (https://ICD.who. 21. Maj M, Reed GM, editors. The ICD-11 int/browse11/l-m/en#/). classification of mood and anxiety disorders: 9. International statistical classification of diseases, Background and options. World Psychiatry. injuries and causes of death, sixth revision. 2012;11(Suppl. 1). Geneva: World Health Organization; 1949. 22. Stein DJ, Kogan CS, Atmaca M, Fineberg NA, Fontenelle LF, Grant JE et al. The classification 10. Manual of the international statistical of obsessive-compulsive and related disorders in classification of diseases, injuries, and causes the ICD-11. J Affect Disord. 2016;190:663–74. of death. Geneva: World Health Organization; doi:10.1016/j.jad.2015.10.061. 1957. 23. Kogan CS, Stein DJ, Maj M, First MB, 11. International statistical classification of diseases, Emmelkamp PM, Reed GM. The classification injuries, and causes of death, eighth revision. of anxiety and fear-related disorders in the Geneva: World Health Organization; 1967. ICD-11. Depress Anxiety. 2016;33(12):1141–54. doi:10.1002/da.22530. 12. Glossary of mental disorders and guide to their classification. Geneva: World Health 24. Maercker A, Brewin CR, Bryant RA, Cloitre M, van Ommeren M, Jones LM et al. Diagnosis and Organization; 1974. classification of disorders specifically associated 13. International statistical classification of diseases, with stress: proposals for ICD-11. World injuries, and causes of death, ninth revision. Psychiatry. 2013;12(3):198–206. doi:10.1002/ Geneva: World Health Organization; 1979. wps.20057. 2 All references accessed 22–28 February 2023. Introduction 17 25. Poznyak V, Reed GM, Medina-Mora ME. 35. Evans SC, Roberts MC, Keeley JW, Blossom Aligning the ICD-11 classification of disorders JB, Amaro CM, Garcia AM et al. Vignette due to substance use with global service needs. methodologies for studying clinicians’ decision- Epidemiol Psychiatr Sci 2018;27(3):212–18. making: validity, utility, and application doi:10.1017/S2045796017000622. in ICD-11 field studies. Int J Clin Health Psychol. 2015;15(2):160–70. doi:10.1016/j. 26. Krueger RB, Reed GM, First MB, Marais",
  "gloss_vi": "16 clinical descriptions and diagnostic requirements for icd-11 mental, behavioural or neurodevelopmental disorders references2 1. world health assembly update, 25 may 2019.",
  "source": "Everyday Essentials",
  "url": "",
  "lang": "en",
  "axes": {
    "type": [
      "clinical",
      "everyday"
    ],
    "condition": [
      "General"
    ],
    "clinical_section": [
      "referral"
    ],
    "life_topics": [
      "stress",
      "study",
      "work",
      "grief"
    ],
    "advice_section": [],
    "audience": [],
    "risk_band": "low"
  },
  "index_text": "General — Referral General — Chuyển tuyến 16 Clinical Descriptions and Diagnostic Requirements for ICD-11 Mental, Behavioural or Neurodevelopmental Disorders References2 1. World Health Assembly Update, 25 May 2019. 14. International statistical classification of diseases Geneva: World Health Organization; 2019 and related health problems, 10th revision. (https://www.who.int/news/item/25-05-2019- Geneva: World Health Organization; 1992. world-health-assembly-update). 15. The ICD-10 classification of mental and 2. ICD-11 Reference Guide. Geneva: World Health behavioural disorders: clinical descriptions and diagnostic guidelines. Geneva: World Health Organization; 2019 (https://icdcdn.who.int/ Organization; 1992. icd11referenceguide/en/html/index.html). 16. First MB, Reed GM, Hyman SE, Saxena S. The 3. Basic documents, 49th edition. Geneva: World development of the ICD-11 clinical descriptions Health Organization; 2020 (https://apps.who. and diagnostic guidelines for mental and int/iris/handle/10665/339554). behavioural disorders. World Psychiatry. 4. International Statistical Classification of 2015;14(1):82–90. doi:10.1002/wps.20189. Diseases and Related Health Problems (ICD). 17. Keeley JW, Reed GM, Roberts MC, Evans SC, Geneva: World Health Organization; 2022 Medina-Mora ME, Robles R et al. Developing (https://www.who.int/standards/classifications/ a science of clinical utility in diagnostic classification-of-diseases). classification systems field study strategies for ICD-11 mental and behavioral disorders. 5. International Advisory Group for the Revision Am Psychol. 2016;71(1):3–16. doi:10.1037/ of ICD-10 Mental and Behavioural Disorders. a0039972. A conceptual framework for the revision of the 18. Reed GM, Sharan P, Rebello TJ, Keeley JW, ICD-10 classification of mental and behavioural Medina-Mora ME, Gureje O et al. The ICD- disorders. World Psychiatry. 2011;10:86–92. 11 developmental field study of reliability of doi:10.1002/j.2051-5545.2011.tb00022.x. diagnoses of high-burden mental disorders: 6. Reed GM, First MB, Kogan CS, Hyman SE, results among adult patients in mental health Gureje O, Gaebel W et al. Innovations and settings of 13 countries. World Psychiatry. changes in the ICD-11 classification of mental, 2018;17(2):174–86. doi:10.1002/wps.20524. behavioural and neurodevelopmental disorders. 19. Reed GM, Keeley JW, Rebello TJ, First MB, World Psychiatry. 2019;18:3–19. doi:10.1002/ Gureje O, Ayuso-Mateos JL et al. Clinical wps.20611. utility of ICD-11 diagnostic guidelines for high-burden mental disorders: results from 7. Rehm J, Shield KD. Global burden of disease mental health settings in 13 countries. World and the impact of mental and addictive Psychiatry. 2018;17(3):306–15. doi:10.1002/ disorders. Curr Psychiatry Rep. 2019;21(2):10. wps.20581. doi:10.1007/s11920-019-0997-0. 20. Gaebel W. Status of psychotic disorders in 8. ICD-11 for Mortality and Morbidity Statistics ICD-11. Schizophr Bull. 2012;38(5):895–8. (ICD-11 MMS) [website]. Geneva: World doi:10.1093/schbul/sbs104. Health Organization; 2023 (https://ICD.who. 21. Maj M, Reed GM, editors. The ICD-11 int/browse11/l-m/en#/). classification of mood and anxiety disorders: 9. International statistical classification of diseases, Background and options. World Psychiatry. injuries and causes of death, sixth revision. 2012;11(Suppl. 1). Geneva: World Health Organization; 1949. 22. Stein DJ, Kogan CS, Atmaca M, Fineberg NA, Fontenelle LF, Grant JE et al. The classification 10. Manual of the international statistical of obsessive-compulsive and related disorders in classification of diseases, injuries, and causes the ICD-11. J Affect Disord. 2016;190:663–74. of death. Geneva: World Health Organization; doi:10.1016/j.jad.2015.10.061. 1957. 23. Kogan CS, Stein DJ, Maj M, First MB, 11. International statistical classification of diseases, Emmelkamp PM, Reed GM. The classification injuries, and causes of death, eighth revision. of anxiety and fear-related disorders in the Geneva: World Health Organization; 1967. ICD-11. Depress Anxiety. 2016;33(12):1141–54. doi:10.1002/da.22530. 12. Glossary of mental disorders and guide to their classification. Geneva: World Health 24. Maercker A, Brewin CR, Bryant RA, Cloitre M, van Ommeren M, Jones LM et al. Diagnosis and Organization; 1974. classification of disorders specifically associated 13. International statistical classification of diseases, with stress: proposals for ICD-11. World injuries, and causes of death, ninth revision. Psychiatry. 2013;12(3):198–206. doi:10.1002/ Geneva: World Health Organization; 1979. wps.20057. 2 All references accessed 22–28 February 2023. Introduction 17 25. Poznyak V, Reed GM, Medina-Mora ME. 35. Evans SC, Roberts MC, Keeley JW, Blossom Aligning the ICD-11 classification of disorders JB, Amaro CM, Garcia AM et al. Vignette due to substance use with global service needs. methodologies for studying clinicians’ decision- Epidemiol Psychiatr Sci 2018;27(3):212–18. making: validity, utility, and application doi:10.1017/S2045796017000622. in ICD-11 field studies. Int J Clin Health Psychol. 2015;15(2):160–70. doi:10.1016/j. 26. Krueger RB, Reed GM, First MB, Marais 16 clinical descriptions and diagnostic requirements for icd-11 mental, behavioural or neurodevelopmental disorders references2 1. world health assembly update, 25 may 2019."
}