{
  "id": "mhgap#referral_6c16fbb9",
  "title_en": "General — Referral",
  "title_vi": "General — Chuyển tuyến",
  "text_en": "outcomes. Evidence on methamphetamine dependence. prescription amphetamines for cocaine dependence is limited by earlier trials that used very small doses. Further research is needed. 68 3. Recommendations DRU3. Which psychosocial interventions are effective in the treatment of stimulant dependence for adults? Recommendation (update): Psychosocial interventions – namely cognitive behavioural therapy (CBT) and contingency management – should be offered to adults with cocaine and stimulant dependence. Strength of recommendation: Strong Certainty of evidence: Low Justification – compared with no treatment, shows little to no y Evidence was extracted from a new systematic difference for: dropout from study and point review by Minozzi et al., 2023 (65 RCTs).10 This is an abstinence at the end of treatment (moderate update to an earlier Cochrane Review by Minozzi et certainty), point (high certainty) and continuous al., 2016 (157). abstinence at longest follow-up (very low certainty), and frequency of drug intake at longest y In adults with stimulant dependence, any follow-up (low certainty); psychosocial interventions: – compared with no treatment, show effect for: – compared with TAU, shows effect for: decreasing dropouts, increasing point abstinence at longest decreasing dropouts from study and frequency follow-up (low certainty), probably increasing of drug intake, increasing longest period of point abstinence at the end of treatment (RR abstinence (moderate certainty), and increasing = 1.73; 95% CI: 0.99 to 3.02), and decreasing continuous abstinence at the end of treatment frequency of drug intake (very low certainty); (low certainty); – compared with no treatment, show little to no – compared with TAU, shows little to no effect for: continuous abstinence at the end of treatment difference for: point abstinence at the end of and on longest period of abstinence (very treatment (high certainty), and point abstinence low certainty). and continuous abstinence at longest follow-up (low certainty); y In adults with stimulant dependence, contingency management: – compared with TAU, show effect for: decreasing dropouts from treatment (moderate certainty), – compared with no treatment, shows effect for: and increasing point abstinence at the end reducing dropouts (low certainty), increasing of treatment and at longest follow-up (very continuous abstinence at the end of treatment low certainty); and point abstinence at longest follow-up, increasing longest period of abstinence, – compared with TAU, show little to no difference and decreasing frequency of drug intake for: continuous abstinence at end of treatment (moderate certainty); (low certainty), increasing continuous abstinence at longest follow-up, and longest period of – compared with no treatment, shows little to abstinence (very low certainty). no difference for: point abstinence at the end of treatment (low certainty), and point and y In adults with stimulant dependence, CBT: continuous abstinence at longest follow-up (very – compared with no treatment, shows effect for: low certainty); increasing continuous abstinence at the end of treatment, and increasing longest period of – compared with TAU, shows effect for: probably reducing dropouts and increasing point abstinence (moderate certainty); 10 Minozzi, S. Which psychosocial interventions are effective in the treatment of stimulant dependence for adults? 2023 (in preparation). 69",
  "gloss_vi": "Outcomes. evidence on methamphetamine dependence.",
  "source": "WHO mhGAP-IG 2023",
  "url": "https://www.who.int/",
  "lang": "en",
  "axes": {
    "type": [
      "clinical",
      "everyday"
    ],
    "condition": [
      "General"
    ],
    "clinical_section": [
      "referral",
      "management"
    ],
    "life_topics": [
      "study"
    ],
    "advice_section": [],
    "audience": [],
    "risk_band": "low"
  },
  "index_text": "General — Referral General — Chuyển tuyến outcomes. Evidence on methamphetamine dependence. prescription amphetamines for cocaine dependence is limited by earlier trials that used very small doses. Further research is needed. 68 3. Recommendations DRU3. Which psychosocial interventions are effective in the treatment of stimulant dependence for adults? Recommendation (update): Psychosocial interventions – namely cognitive behavioural therapy (CBT) and contingency management – should be offered to adults with cocaine and stimulant dependence. Strength of recommendation: Strong Certainty of evidence: Low Justification – compared with no treatment, shows little to no y Evidence was extracted from a new systematic difference for: dropout from study and point review by Minozzi et al., 2023 (65 RCTs).10 This is an abstinence at the end of treatment (moderate update to an earlier Cochrane Review by Minozzi et certainty), point (high certainty) and continuous al., 2016 (157). abstinence at longest follow-up (very low certainty), and frequency of drug intake at longest y In adults with stimulant dependence, any follow-up (low certainty); psychosocial interventions: – compared with no treatment, show effect for: – compared with TAU, shows effect for: decreasing dropouts, increasing point abstinence at longest decreasing dropouts from study and frequency follow-up (low certainty), probably increasing of drug intake, increasing longest period of point abstinence at the end of treatment (RR abstinence (moderate certainty), and increasing = 1.73; 95% CI: 0.99 to 3.02), and decreasing continuous abstinence at the end of treatment frequency of drug intake (very low certainty); (low certainty); – compared with no treatment, show little to no – compared with TAU, shows little to no effect for: continuous abstinence at the end of treatment difference for: point abstinence at the end of and on longest period of abstinence (very treatment (high certainty), and point abstinence low certainty). and continuous abstinence at longest follow-up (low certainty); y In adults with stimulant dependence, contingency management: – compared with TAU, show effect for: decreasing dropouts from treatment (moderate certainty), – compared with no treatment, shows effect for: and increasing point abstinence at the end reducing dropouts (low certainty), increasing of treatment and at longest follow-up (very continuous abstinence at the end of treatment low certainty); and point abstinence at longest follow-up, increasing longest period of abstinence, – compared with TAU, show little to no difference and decreasing frequency of drug intake for: continuous abstinence at end of treatment (moderate certainty); (low certainty), increasing continuous abstinence at longest follow-up, and longest period of – compared with no treatment, shows little to abstinence (very low certainty). no difference for: point abstinence at the end of treatment (low certainty), and point and y In adults with stimulant dependence, CBT: continuous abstinence at longest follow-up (very – compared with no treatment, shows effect for: low certainty); increasing continuous abstinence at the end of treatment, and increasing longest period of – compared with TAU, shows effect for: probably reducing dropouts and increasing point abstinence (moderate certainty); 10 Minozzi, S. Which psychosocial interventions are effective in the treatment of stimulant dependence for adults? 2023 (in preparation). 69 Outcomes. evidence on methamphetamine dependence."
}