{
  "id": "everyday#screening_cues_ddeea705",
  "title_en": "General — Screening Cues",
  "title_vi": "General — Dấu hiệu sàng lọc",
  "text_en": "age 5 years. G. The child has a developmental age of at least 9 months. Specify if: Persistent: The disorder has been present for more than 12 months. Specify current severity: Reactive attachment disorder is specified as severe when a child exhibits all symptoms of the disorder, with each symptom manifesting at relatively high levels. Disinhibited Social Engagement Disorder 313.89 (F94.2) A. A pattern of behavior in which a child actively approaches and inter- acts with unfamiliar adults and exhibits at least two of the following: 1. Reduced or absent reticence in approaching and interacting with unfamiliar adults. 2. Overly familiar verbal or physical behavior (that is not consis- tent with culturally sanctioned and with age-appropriate so- cial boundaries). 3. Diminished or absent checking back with adult caregiver af- ter venturing away, even in unfamiliar settings. 4. Willingness to go off with an unfamiliar adult with minimal or no hesitation. B. The behaviors in Criterion A are not limited to impulsivity (as in attention-deficit/hyperactivity disorder) but include socially disin- hibited behavior. C. The child has experienced a pattern of extremes of insufficient care as evidenced by at least one of the following: 1. Social neglect or deprivation in the form of persistent lack of having basic emotional needs for comfort, stimulation, and affection met by caregiving adults. 2. Repeated changes of primary caregivers that limit oppor- tunities to form stable attachments (e.g., frequent changes in foster care).",
  "gloss_vi": "Age 5 years. g.",
  "source": "Everyday Essentials",
  "url": "",
  "lang": "en",
  "axes": {
    "type": [
      "clinical"
    ],
    "condition": [
      "General"
    ],
    "clinical_section": [
      "screening_cues",
      "caregiver"
    ],
    "life_topics": [],
    "advice_section": [],
    "audience": [],
    "risk_band": "low"
  },
  "index_text": "General — Screening Cues General — Dấu hiệu sàng lọc age 5 years. G. The child has a developmental age of at least 9 months. Specify if: Persistent: The disorder has been present for more than 12 months. Specify current severity: Reactive attachment disorder is specified as severe when a child exhibits all symptoms of the disorder, with each symptom manifesting at relatively high levels. Disinhibited Social Engagement Disorder 313.89 (F94.2) A. A pattern of behavior in which a child actively approaches and inter- acts with unfamiliar adults and exhibits at least two of the following: 1. Reduced or absent reticence in approaching and interacting with unfamiliar adults. 2. Overly familiar verbal or physical behavior (that is not consis- tent with culturally sanctioned and with age-appropriate so- cial boundaries). 3. Diminished or absent checking back with adult caregiver af- ter venturing away, even in unfamiliar settings. 4. Willingness to go off with an unfamiliar adult with minimal or no hesitation. B. The behaviors in Criterion A are not limited to impulsivity (as in attention-deficit/hyperactivity disorder) but include socially disin- hibited behavior. C. The child has experienced a pattern of extremes of insufficient care as evidenced by at least one of the following: 1. Social neglect or deprivation in the form of persistent lack of having basic emotional needs for comfort, stimulation, and affection met by caregiving adults. 2. Repeated changes of primary caregivers that limit oppor- tunities to form stable attachments (e.g., frequent changes in foster care). Age 5 years. g."
}