{
  "id": "everyday#psychoeducation_f3af2aec",
  "title_en": "General — Psychoeducation",
  "title_vi": "General — Giáo dục tâm lý",
  "text_en": "116 Anxiety Disorders C. The disturbance causes clinically significant distress or impair- ment in social, academic, occupational, or other important areas of functioning. D. The disturbance is not better explained by another mental disor- der, such as refusing to leave home because of excessive resis- tance to change in autism spectrum disorder; delusions or hallucinations concerning separation in psychotic disorders; re- fusal to go outside without a trusted companion in agoraphobia; worries about ill health or other harm befalling significant others in generalized anxiety disorder; or concerns about having an ill- ness in illness anxiety disorder. Selective Mutism 313.23 (F94.0) A. Consistent failure to speak in specific social situations in which there is an expectation for speaking (e.g., at school) despite speaking in other situations. B. The disturbance interferes with educational or occupational achievement or with social communication. C. The duration of the disturbance is at least 1 month (not limited to the first month of school). D. The failure to speak is not attributable to a lack of knowledge of, or comfort with, the spoken language required in the social situation. E. The disturbance is not better explained by a communication dis- order (e.g., childhood-onset fluency disorder) and does not oc- cur exclusively during the course of autism spectrum disorder, schizophrenia, or another psychotic disorder. Specific Phobia A. Marked fear or anxiety about a specific object or situation (e.g., flying, heights, animals, receiving an injection, seeing blood). Note: In children, the fear or anxiety may be expressed by cry- ing, tantrums, freezing, or clinging. B. The phobic object or situation almost always provokes immedi- ate fear or anxiety. Specific Phobia 117 C. The",
  "gloss_vi": "116 lo âu disorders c. the disturbance causes clinically significant distress or impair- ment in social, academic, occupational, or other important areas of functioning.",
  "source": "Everyday Essentials",
  "url": "",
  "lang": "en",
  "axes": {
    "type": [
      "clinical",
      "everyday"
    ],
    "condition": [
      "General"
    ],
    "clinical_section": [
      "psychoeducation"
    ],
    "life_topics": [
      "stress"
    ],
    "advice_section": [],
    "audience": [],
    "risk_band": "low"
  },
  "index_text": "General — Psychoeducation General — Giáo dục tâm lý 116 Anxiety Disorders C. The disturbance causes clinically significant distress or impair- ment in social, academic, occupational, or other important areas of functioning. D. The disturbance is not better explained by another mental disor- der, such as refusing to leave home because of excessive resis- tance to change in autism spectrum disorder; delusions or hallucinations concerning separation in psychotic disorders; re- fusal to go outside without a trusted companion in agoraphobia; worries about ill health or other harm befalling significant others in generalized anxiety disorder; or concerns about having an ill- ness in illness anxiety disorder. Selective Mutism 313.23 (F94.0) A. Consistent failure to speak in specific social situations in which there is an expectation for speaking (e.g., at school) despite speaking in other situations. B. The disturbance interferes with educational or occupational achievement or with social communication. C. The duration of the disturbance is at least 1 month (not limited to the first month of school). D. The failure to speak is not attributable to a lack of knowledge of, or comfort with, the spoken language required in the social situation. E. The disturbance is not better explained by a communication dis- order (e.g., childhood-onset fluency disorder) and does not oc- cur exclusively during the course of autism spectrum disorder, schizophrenia, or another psychotic disorder. Specific Phobia A. Marked fear or anxiety about a specific object or situation (e.g., flying, heights, animals, receiving an injection, seeing blood). Note: In children, the fear or anxiety may be expressed by cry- ing, tantrums, freezing, or clinging. B. The phobic object or situation almost always provokes immedi- ate fear or anxiety. Specific Phobia 117 C. The 116 lo âu disorders c. the disturbance causes clinically significant distress or impair- ment in social, academic, occupational, or other important areas of functioning."
}