{
  "id": "everyday#management_cf422637",
  "title_en": "General — Management",
  "title_vi": "General — Management",
  "text_en": "370 Other Conditions That May Be a Focus of Clinical Attention Other Problems Related to the Social Environment V62.89 (Z60.0) Phase of Life Problem This category should be used when a problem adjusting to a life-cycle transition (a particular developmental phase) is the focus of clinical attention or has an impact on the individual’s treatment or prognosis. Examples of such transitions include entering or completing school, leaving parental control, getting married, starting a new career, be- coming a parent, adjusting to an “empty nest” after children leave home, and retiring. V60.3 (Z60.2) Problem Related to Living Alone This category should be used when a problem associated with living alone is the focus of clinical attention or has an impact on the individ- ual’s treatment or prognosis. Examples of such problems include chronic feelings of loneliness, isolation, and lack of structure in car- rying out activities of daily living (e.g., irregular meal and sleep schedules, inconsistent performance of home maintenance chores). V62.4 (Z60.3) Acculturation Difficulty This category should be used when difficulty in adjusting to a new culture (e.g., following migration) is the focus of clinical attention or has an impact on the individual’s treatment or prognosis. V62.4 (Z60.4) Social Exclusion or Rejection This category should be used when there is an imbalance of social power such that there is recurrent social exclusion or rejection by oth- ers. Examples of social rejection include bullying, teasing, and intim- idation by others; being targeted by others for verbal abuse and humiliation; and being purposefully excluded from the activities of peers, workmates, or others in one’s social environment. V62.4 (Z60.5) Target of (Perceived) Adverse Discrimination or Persecution This category should be used when there is perceived or experienced discrimination against or persecution",
  "gloss_vi": "370 other conditions that may be a focus of clinical attention other problems related to the social environment v62.89 (z60.0) phase of life problem this category should be used when a problem adjusting to a life-cycle t...",
  "source": "Everyday Essentials",
  "url": "",
  "lang": "en",
  "axes": {
    "type": [
      "clinical",
      "everyday"
    ],
    "condition": [
      "General"
    ],
    "clinical_section": [
      "management"
    ],
    "life_topics": [
      "sleep",
      "study",
      "work"
    ],
    "advice_section": [],
    "audience": [],
    "risk_band": "low"
  },
  "index_text": "General — Management General — Management 370 Other Conditions That May Be a Focus of Clinical Attention Other Problems Related to the Social Environment V62.89 (Z60.0) Phase of Life Problem This category should be used when a problem adjusting to a life-cycle transition (a particular developmental phase) is the focus of clinical attention or has an impact on the individual’s treatment or prognosis. Examples of such transitions include entering or completing school, leaving parental control, getting married, starting a new career, be- coming a parent, adjusting to an “empty nest” after children leave home, and retiring. V60.3 (Z60.2) Problem Related to Living Alone This category should be used when a problem associated with living alone is the focus of clinical attention or has an impact on the individ- ual’s treatment or prognosis. Examples of such problems include chronic feelings of loneliness, isolation, and lack of structure in car- rying out activities of daily living (e.g., irregular meal and sleep schedules, inconsistent performance of home maintenance chores). V62.4 (Z60.3) Acculturation Difficulty This category should be used when difficulty in adjusting to a new culture (e.g., following migration) is the focus of clinical attention or has an impact on the individual’s treatment or prognosis. V62.4 (Z60.4) Social Exclusion or Rejection This category should be used when there is an imbalance of social power such that there is recurrent social exclusion or rejection by oth- ers. Examples of social rejection include bullying, teasing, and intim- idation by others; being targeted by others for verbal abuse and humiliation; and being purposefully excluded from the activities of peers, workmates, or others in one’s social environment. V62.4 (Z60.5) Target of (Perceived) Adverse Discrimination or Persecution This category should be used when there is perceived or experienced discrimination against or persecution 370 other conditions that may be a focus of clinical attention other problems related to the social environment v62.89 (z60.0) phase of life problem this category should be used when a problem adjusting to a life-cycle t..."
}