{
  "id": "everyday#screening_cues_b6b9ac77",
  "title_en": "General — Screening Cues",
  "title_vi": "General — Dấu hiệu sàng lọc",
  "text_en": "tactile, or auditory hallucinations or illu- sions. 6. Psychomotor agitation. 7. Anxiety. 8. Generalized tonic-clonic seizures. C. The signs or symptoms in Criterion B cause clinically significant distress or impairment in social, occupational, or other important areas of functioning. D. The signs or symptoms are not attributable to another medical condition and are not better explained by another mental disor- der, including intoxication or withdrawal from another substance. Specify if: With perceptual disturbances: This specifier applies in the rare instance when hallucinations (usually visual or tactile) occur with intact reality testing, or auditory, visual, or tactile illusions occur in the absence of a delirium. Coding note: The ICD-9-CM code is 291.81. The ICD-10-CM code for alcohol withdrawal without perceptual disturbances is F10.239, and the ICD-10-CM code for alcohol withdrawal with perceptual dis- turbances is F10.232. Note that the ICD-10-CM code indicates the comorbid presence of a moderate or severe alcohol use disorder, reflecting the fact that alcohol withdrawal can only occur in the presence of a moderate or severe alcohol use disorder. It is not per- missible to code a comorbid mild alcohol use disorder with alcohol withdrawal. Other Alcohol-Induced Disorders The following alcohol-induced disorders are described in other chap- ters of the book with disorders with which they share phenomenol- ogy (see the substance/medication-induced mental disorders in these chapters): alcohol-induced psychotic disorder (“Schizophrenia Spec- trum and Other Psychotic Disorders”); alcohol-induced bipolar dis- order (“Bipolar and Related Disorders”); alcohol-induced depressive",
  "gloss_vi": "Tactile, or auditory hallucinations or illu- sions. 6.",
  "source": "Everyday Essentials",
  "url": "",
  "lang": "en",
  "axes": {
    "type": [
      "clinical",
      "everyday"
    ],
    "condition": [
      "General"
    ],
    "clinical_section": [
      "screening_cues"
    ],
    "life_topics": [
      "stress"
    ],
    "advice_section": [],
    "audience": [],
    "risk_band": "low"
  },
  "index_text": "General — Screening Cues General — Dấu hiệu sàng lọc tactile, or auditory hallucinations or illu- sions. 6. Psychomotor agitation. 7. Anxiety. 8. Generalized tonic-clonic seizures. C. The signs or symptoms in Criterion B cause clinically significant distress or impairment in social, occupational, or other important areas of functioning. D. The signs or symptoms are not attributable to another medical condition and are not better explained by another mental disor- der, including intoxication or withdrawal from another substance. Specify if: With perceptual disturbances: This specifier applies in the rare instance when hallucinations (usually visual or tactile) occur with intact reality testing, or auditory, visual, or tactile illusions occur in the absence of a delirium. Coding note: The ICD-9-CM code is 291.81. The ICD-10-CM code for alcohol withdrawal without perceptual disturbances is F10.239, and the ICD-10-CM code for alcohol withdrawal with perceptual dis- turbances is F10.232. Note that the ICD-10-CM code indicates the comorbid presence of a moderate or severe alcohol use disorder, reflecting the fact that alcohol withdrawal can only occur in the presence of a moderate or severe alcohol use disorder. It is not per- missible to code a comorbid mild alcohol use disorder with alcohol withdrawal. Other Alcohol-Induced Disorders The following alcohol-induced disorders are described in other chap- ters of the book with disorders with which they share phenomenol- ogy (see the substance/medication-induced mental disorders in these chapters): alcohol-induced psychotic disorder (“Schizophrenia Spec- trum and Other Psychotic Disorders”); alcohol-induced bipolar dis- order (“Bipolar and Related Disorders”); alcohol-induced depressive Tactile, or auditory hallucinations or illu- sions. 6."
}