{
  "id": "everyday#screening_cues_72c1c24b",
  "title_en": "General — Screening Cues",
  "title_vi": "General — Dấu hiệu sàng lọc",
  "text_en": "the traumatic event(s). 148 Trauma- and Stressor-Related Disorders 2. Avoidance of or efforts to avoid people, conversations, or in- terpersonal situations that arouse recollections of the trau- matic event(s). Negative Alterations in Cognitions 3. Substantially increased frequency of negative emotional states (e.g., fear, guilt, sadness, shame, confusion). 4. Markedly diminished interest or participation in significant activities, including constriction of play. 5. Socially withdrawn behavior. 6. Persistent reduction in expression of positive emotions. D. Alterations in arousal and reactivity associated with the traumatic event(s), beginning or worsening after the traumatic event(s) oc- curred, as evidenced by two (or more) of the following: 1. Irritable behavior and angry outbursts (with little or no provoca- tion) typically expressed as verbal or physical aggression to- ward people or objects (including extreme temper tantrums). 2. Hypervigilance. 3. Exaggerated startle response. 4. Problems with concentration. 5. Sleep disturbance (e.g., difficulty falling or staying asleep or restless sleep). E. The duration of the disturbance is more than 1 month. F. The disturbance causes clinically significant distress or impair- ment in relationships with parents, siblings, peers, or other care- givers or with school behavior. G. The disturbance is not attributable to the physiological effects of a substance (e.g., medication or alcohol) or another medical con- dition. Specify whether: With dissociative symptoms: The individual’s symptoms meet the criteria for posttraumatic stress disorder, and the individual experiences persistent or recurrent symptoms of either of the fol- lowing: 1. Depersonalization: Persistent or recurrent experiences of feeling detached from, and as if one were an outside ob-",
  "gloss_vi": "The traumatic event(s). 148 trauma- and stressor-related disorders 2.",
  "source": "Everyday Essentials",
  "url": "",
  "lang": "en",
  "axes": {
    "type": [
      "clinical",
      "everyday"
    ],
    "condition": [
      "General"
    ],
    "clinical_section": [
      "screening_cues",
      "do_not_do"
    ],
    "life_topics": [
      "sleep",
      "stress",
      "relationships"
    ],
    "advice_section": [
      "work_habits"
    ],
    "audience": [],
    "risk_band": "low"
  },
  "index_text": "General — Screening Cues General — Dấu hiệu sàng lọc the traumatic event(s). 148 Trauma- and Stressor-Related Disorders 2. Avoidance of or efforts to avoid people, conversations, or in- terpersonal situations that arouse recollections of the trau- matic event(s). Negative Alterations in Cognitions 3. Substantially increased frequency of negative emotional states (e.g., fear, guilt, sadness, shame, confusion). 4. Markedly diminished interest or participation in significant activities, including constriction of play. 5. Socially withdrawn behavior. 6. Persistent reduction in expression of positive emotions. D. Alterations in arousal and reactivity associated with the traumatic event(s), beginning or worsening after the traumatic event(s) oc- curred, as evidenced by two (or more) of the following: 1. Irritable behavior and angry outbursts (with little or no provoca- tion) typically expressed as verbal or physical aggression to- ward people or objects (including extreme temper tantrums). 2. Hypervigilance. 3. Exaggerated startle response. 4. Problems with concentration. 5. Sleep disturbance (e.g., difficulty falling or staying asleep or restless sleep). E. The duration of the disturbance is more than 1 month. F. The disturbance causes clinically significant distress or impair- ment in relationships with parents, siblings, peers, or other care- givers or with school behavior. G. The disturbance is not attributable to the physiological effects of a substance (e.g., medication or alcohol) or another medical con- dition. Specify whether: With dissociative symptoms: The individual’s symptoms meet the criteria for posttraumatic stress disorder, and the individual experiences persistent or recurrent symptoms of either of the fol- lowing: 1. Depersonalization: Persistent or recurrent experiences of feeling detached from, and as if one were an outside ob- The traumatic event(s). 148 trauma- and stressor-related disorders 2."
}