{
  "id": "everyday#screening_cues_b41b13a8",
  "title_en": "General — Screening Cues",
  "title_vi": "General — Dấu hiệu sàng lọc",
  "text_en": "or withdrawal or after exposure to a medication. 2. The involved substance/medication is capable of producing the symptoms in Criterion A. C. The disturbance is not better explained by a bipolar or related disor- der that is not substance/medication-induced. Such evidence of an independent bipolar or related disorder could include the following: The symptoms precede the onset of the substance/medica- tion use; the symptoms persist for a substantial period of time (e.g., about 1 month) after the cessation of acute withdrawal or severe intoxication; or there is other evidence suggesting the existence of an independent non-substance/medication- induced bipolar and related disorder (e.g., a history of recur- rent non-substance/medication-related episodes). D. The disturbance does not occur exclusively during the course of a delirium. E. The disturbance causes clinically significant distress or impairment in social, occupational, or other important areas of functioning. Coding note: The ICD-9-CM and ICD-10-CM codes for the [specific substance/medication]-induced bipolar and related disorders are in- dicated in the table below. Note that the ICD-10-CM code depends on whether or not there is a comorbid substance use disorder pres- ent for the same class of substance. If a mild substance use disorder is comorbid with the substance-induced bipolar and related disorder, the 4th position character is “1,” and the clinician should record “mild [substance] use disorder” before the substance-induced bipolar and related disorder (e.g., “mild cocaine use disorder with cocaine- induced bipolar and related disorder”). If a moderate or severe sub- stance use disorder is comorbid with the substance-induced bipolar and related disorder, the 4th position character is “2,” and the clini- cian should record “moderate [substance] use disorder” or “severe [substance] use disorder,” depending on the severity of the comorbid",
  "gloss_vi": "Or withdrawal or after exposure to a medication. 2.",
  "source": "Everyday Essentials",
  "url": "",
  "lang": "en",
  "axes": {
    "type": [
      "clinical",
      "everyday"
    ],
    "condition": [
      "General"
    ],
    "clinical_section": [
      "screening_cues"
    ],
    "life_topics": [
      "stress"
    ],
    "advice_section": [],
    "audience": [],
    "risk_band": "low"
  },
  "index_text": "General — Screening Cues General — Dấu hiệu sàng lọc or withdrawal or after exposure to a medication. 2. The involved substance/medication is capable of producing the symptoms in Criterion A. C. The disturbance is not better explained by a bipolar or related disor- der that is not substance/medication-induced. Such evidence of an independent bipolar or related disorder could include the following: The symptoms precede the onset of the substance/medica- tion use; the symptoms persist for a substantial period of time (e.g., about 1 month) after the cessation of acute withdrawal or severe intoxication; or there is other evidence suggesting the existence of an independent non-substance/medication- induced bipolar and related disorder (e.g., a history of recur- rent non-substance/medication-related episodes). D. The disturbance does not occur exclusively during the course of a delirium. E. The disturbance causes clinically significant distress or impairment in social, occupational, or other important areas of functioning. Coding note: The ICD-9-CM and ICD-10-CM codes for the [specific substance/medication]-induced bipolar and related disorders are in- dicated in the table below. Note that the ICD-10-CM code depends on whether or not there is a comorbid substance use disorder pres- ent for the same class of substance. If a mild substance use disorder is comorbid with the substance-induced bipolar and related disorder, the 4th position character is “1,” and the clinician should record “mild [substance] use disorder” before the substance-induced bipolar and related disorder (e.g., “mild cocaine use disorder with cocaine- induced bipolar and related disorder”). If a moderate or severe sub- stance use disorder is comorbid with the substance-induced bipolar and related disorder, the 4th position character is “2,” and the clini- cian should record “moderate [substance] use disorder” or “severe [substance] use disorder,” depending on the severity of the comorbid Or withdrawal or after exposure to a medication. 2."
}