{
  "id": "everyday#screening_cues_ff8c2fb4",
  "title_en": "General — Screening Cues",
  "title_vi": "General — Dấu hiệu sàng lọc",
  "text_en": "the recur- rent outbursts is grossly out of proportion to the provocation or to any precipitating psychosocial stressors. C. The recurrent aggressive outbursts are not premeditated (i.e., they are impulsive and/or anger-based) and are not committed to achieve some tangible objective (e.g., money, power, intimidation). D. The recurrent aggressive outbursts cause either marked distress in the individual or impairment in occupational or interpersonal func- tioning, or are associated with financial or legal consequences. E. Chronological age is at least 6 years (or equivalent developmen- tal level). F. The recurrent aggressive outbursts are not better explained by another mental disorder (e.g., major depressive disorder, bipolar disorder, disruptive mood dysregulation disorder, a psychotic dis- order, antisocial personality disorder, borderline personality disor- der) and are not attributable to another medical condition (e.g., head trauma, Alzheimer’s disease) or to the physiological effects of a substance (e.g., a drug of abuse, a medication). For children ages 6–18 years, aggressive behavior that occurs as part of an ad- justment disorder should not be considered for this diagnosis. Note: This diagnosis can be made in addition to the diagnosis of at- tention-deficit/hyperactivity disorder, conduct disorder, oppositional defiant disorder, or autism spectrum disorder when recurrent impul- sive aggressive outbursts are in excess of those usually seen in these disorders and warrant independent clinical attention. Conduct Disorder A. A repetitive and persistent pattern of behavior in which the basic rights of others or major age-appropriate societal norms or rules are violated, as manifested by the presence of at least three of the fol- lowing 15 criteria in the past 12 months from any of the categories below, with at least one criterion present in the past 6 months: Aggression to People and Animals 1. Often bullies, threatens, or intimidates others. 2. Often initiates physical fights.",
  "gloss_vi": "The recur- rent outbursts is grossly out of proportion to the provocation or to any precipitating psychosocial stressors. c.",
  "source": "Everyday Essentials",
  "url": "",
  "lang": "en",
  "axes": {
    "type": [
      "clinical",
      "everyday"
    ],
    "condition": [
      "General"
    ],
    "clinical_section": [
      "screening_cues"
    ],
    "life_topics": [
      "stress"
    ],
    "advice_section": [],
    "audience": [],
    "risk_band": "low"
  },
  "index_text": "General — Screening Cues General — Dấu hiệu sàng lọc the recur- rent outbursts is grossly out of proportion to the provocation or to any precipitating psychosocial stressors. C. The recurrent aggressive outbursts are not premeditated (i.e., they are impulsive and/or anger-based) and are not committed to achieve some tangible objective (e.g., money, power, intimidation). D. The recurrent aggressive outbursts cause either marked distress in the individual or impairment in occupational or interpersonal func- tioning, or are associated with financial or legal consequences. E. Chronological age is at least 6 years (or equivalent developmen- tal level). F. The recurrent aggressive outbursts are not better explained by another mental disorder (e.g., major depressive disorder, bipolar disorder, disruptive mood dysregulation disorder, a psychotic dis- order, antisocial personality disorder, borderline personality disor- der) and are not attributable to another medical condition (e.g., head trauma, Alzheimer’s disease) or to the physiological effects of a substance (e.g., a drug of abuse, a medication). For children ages 6–18 years, aggressive behavior that occurs as part of an ad- justment disorder should not be considered for this diagnosis. Note: This diagnosis can be made in addition to the diagnosis of at- tention-deficit/hyperactivity disorder, conduct disorder, oppositional defiant disorder, or autism spectrum disorder when recurrent impul- sive aggressive outbursts are in excess of those usually seen in these disorders and warrant independent clinical attention. Conduct Disorder A. A repetitive and persistent pattern of behavior in which the basic rights of others or major age-appropriate societal norms or rules are violated, as manifested by the presence of at least three of the fol- lowing 15 criteria in the past 12 months from any of the categories below, with at least one criterion present in the past 6 months: Aggression to People and Animals 1. Often bullies, threatens, or intimidates others. 2. Often initiates physical fights. The recur- rent outbursts is grossly out of proportion to the provocation or to any precipitating psychosocial stressors. c."
}