{
  "id": "everyday#screening_cues_59afeeab",
  "title_en": "General — Screening Cues",
  "title_vi": "General — Dấu hiệu sàng lọc",
  "text_en": "This page intentionally left blank Feeding and Eating Disorders Pica A. Persistent eating of nonnutritive, nonfood substances over a pe- riod of at least 1 month. B. The eating of nonnutritive, nonfood substances is inappropriate to the developmental level of the individual. C. The eating behavior is not part of a culturally supported or socially normative practice. D. If the eating behavior occurs in the context of another mental disorder (e.g., intellectual disability [intellectual developmental disorder], autism spectrum disorder, schizophrenia) or medical condition (including pregnancy), it is sufficiently severe to war- rant additional clinical attention. Coding note: The ICD-9-CM code for pica is 307.52 and is used for children or adults. The ICD-10-CM codes for pica are (F98.3) in chil- dren and (F50.8) in adults. Specify if: In remission: After full criteria for pica were previously met, the criteria have not been met for a sustained period of time. Rumination Disorder 307.53 (F98.21) A. Repeated regurgitation of food over a period of at least 1 month. Regurgitated food may be re-chewed, re-swallowed, or spit out. B. The repeated regurgitation is not attributable to an associated gastrointestinal or other medical condition (e.g., gastroesopha- geal reflux, pyloric stenosis). 169",
  "gloss_vi": "This page intentionally left blank feeding and eating disorders pica a. persistent eating of nonnutritive, nonfood substances over a pe- riod of at least 1 month.",
  "source": "Everyday Essentials",
  "url": "",
  "lang": "en",
  "axes": {
    "type": [
      "clinical"
    ],
    "condition": [
      "General"
    ],
    "clinical_section": [
      "screening_cues",
      "psychoeducation"
    ],
    "life_topics": [],
    "advice_section": [],
    "audience": [],
    "risk_band": "low"
  },
  "index_text": "General — Screening Cues General — Dấu hiệu sàng lọc This page intentionally left blank Feeding and Eating Disorders Pica A. Persistent eating of nonnutritive, nonfood substances over a pe- riod of at least 1 month. B. The eating of nonnutritive, nonfood substances is inappropriate to the developmental level of the individual. C. The eating behavior is not part of a culturally supported or socially normative practice. D. If the eating behavior occurs in the context of another mental disorder (e.g., intellectual disability [intellectual developmental disorder], autism spectrum disorder, schizophrenia) or medical condition (including pregnancy), it is sufficiently severe to war- rant additional clinical attention. Coding note: The ICD-9-CM code for pica is 307.52 and is used for children or adults. The ICD-10-CM codes for pica are (F98.3) in chil- dren and (F50.8) in adults. Specify if: In remission: After full criteria for pica were previously met, the criteria have not been met for a sustained period of time. Rumination Disorder 307.53 (F98.21) A. Repeated regurgitation of food over a period of at least 1 month. Regurgitated food may be re-chewed, re-swallowed, or spit out. B. The repeated regurgitation is not attributable to an associated gastrointestinal or other medical condition (e.g., gastroesopha- geal reflux, pyloric stenosis). 169 This page intentionally left blank feeding and eating disorders pica a. persistent eating of nonnutritive, nonfood substances over a pe- riod of at least 1 month."
}