{
  "id": "everyday#screening_cues_c4129c52",
  "title_en": "General — Screening Cues",
  "title_vi": "General — Dấu hiệu sàng lọc",
  "text_en": "Anxiety Disorders Separation Anxiety Disorder 309.21 (F93.0) A. Developmentally inappropriate and excessive fear or anxiety concerning separation from those to whom the individual is at- tached, as evidenced by at least three of the following: 1. Recurrent excessive distress when anticipating or experiencing separation from home or from major attachment figures. 2. Persistent and excessive worry about losing major attach- ment figures or about possible harm to them, such as illness, injury, disasters, or death. 3. Persistent and excessive worry about experiencing an un- toward event (e.g., getting lost, being kidnapped, having an accident, becoming ill) that causes separation from a major attachment figure. 4. Persistent reluctance or refusal to go out, away from home, to school, to work, or elsewhere because of fear of separation. 5. Persistent and excessive fear of or reluctance about being alone or without major attachment figures at home or in other settings. 6. Persistent reluctance or refusal to sleep away from home or to go to sleep without being near a major attachment figure. 7. Repeated nightmares involving the theme of separation. 8. Repeated complaints of physical symptoms (e.g., head- aches, stomachaches, nausea, vomiting) when separation from major attachment figures occurs or is anticipated. B. The fear, anxiety, or avoidance is persistent, lasting at least 4 weeks in children and adolescents and typically 6 months or more in adults. 115 116 Anxiety Disorders C. The disturbance causes clinically significant distress or impair- ment in social, academic, occupational, or other important areas",
  "gloss_vi": "Lo âu disorders separation lo âu disorder 309.21 (f93.0) a. developmentally inappropriate and excessive fear or lo âu concerning separation from those to whom the individual is at- tached, as evidenced by at least three ...",
  "source": "Everyday Essentials",
  "url": "",
  "lang": "en",
  "axes": {
    "type": [
      "clinical",
      "everyday"
    ],
    "condition": [
      "General"
    ],
    "clinical_section": [
      "screening_cues",
      "do_not_do"
    ],
    "life_topics": [
      "sleep",
      "stress",
      "work"
    ],
    "advice_section": [],
    "audience": [],
    "risk_band": "low"
  },
  "index_text": "General — Screening Cues General — Dấu hiệu sàng lọc Anxiety Disorders Separation Anxiety Disorder 309.21 (F93.0) A. Developmentally inappropriate and excessive fear or anxiety concerning separation from those to whom the individual is at- tached, as evidenced by at least three of the following: 1. Recurrent excessive distress when anticipating or experiencing separation from home or from major attachment figures. 2. Persistent and excessive worry about losing major attach- ment figures or about possible harm to them, such as illness, injury, disasters, or death. 3. Persistent and excessive worry about experiencing an un- toward event (e.g., getting lost, being kidnapped, having an accident, becoming ill) that causes separation from a major attachment figure. 4. Persistent reluctance or refusal to go out, away from home, to school, to work, or elsewhere because of fear of separation. 5. Persistent and excessive fear of or reluctance about being alone or without major attachment figures at home or in other settings. 6. Persistent reluctance or refusal to sleep away from home or to go to sleep without being near a major attachment figure. 7. Repeated nightmares involving the theme of separation. 8. Repeated complaints of physical symptoms (e.g., head- aches, stomachaches, nausea, vomiting) when separation from major attachment figures occurs or is anticipated. B. The fear, anxiety, or avoidance is persistent, lasting at least 4 weeks in children and adolescents and typically 6 months or more in adults. 115 116 Anxiety Disorders C. The disturbance causes clinically significant distress or impair- ment in social, academic, occupational, or other important areas Lo âu disorders separation lo âu disorder 309.21 (f93.0) a. developmentally inappropriate and excessive fear or lo âu concerning separation from those to whom the individual is at- tached, as evidenced by at least three ..."
}