{
  "id": "everyday#screening_cues_fba1a791",
  "title_en": "General — Screening Cues",
  "title_vi": "General — Dấu hiệu sàng lọc",
  "text_en": "36 Neurodevelopmental Disorders Specific Learning Disorder Specific Learning Disorder A. Difficulties learning and using academic skills, as indicated by the presence of at least one of the following symptoms that have persisted for at least 6 months, despite the provision of interven- tions that target those difficulties: 1. Inaccurate or slow and effortful word reading (e.g., reads sin- gle words aloud incorrectly or slowly and hesitantly, fre- quently guesses words, has difficulty sounding out words). 2. Difficulty understanding the meaning of what is read (e.g., may read text accurately but not understand the sequence, re- lationships, inferences, or deeper meanings of what is read). 3. Difficulties with spelling (e.g., may add, omit, or substitute vowels or consonants). 4. Difficulties with written expression (e.g., makes multiple gram- matical or punctuation errors within sentences; employs poor paragraph organization; written expression of ideas lacks clarity). 5. Difficulties mastering number sense, number facts, or calcula- tion (e.g., has poor understanding of numbers, their magnitude, and relationships; counts on fingers to add single-digit numbers instead of recalling the math fact as peers do; gets lost in the midst of arithmetic computation and may switch procedures). 6. Difficulties with mathematical reasoning (e.g., has severe dif- ficulty applying mathematical concepts, facts, or procedures to solve quantitative problems). B. The affected academic skills are substantially and quantifiably be- low those expected for the individual’s chronological age, and cause significant interference with academic or occupational per- formance, or with activities of daily living, as confirmed by indi- vidually administered standardized achievement measures and comprehensive clinical assessment. For individuals age 17 years and older, a documented history of",
  "gloss_vi": "36 neurodevelopmental disorders specific learning disorder specific learning disorder a. difficulties learning and using academic skills, as indicated by the presence of at least one of the following symptoms that have p...",
  "source": "Everyday Essentials",
  "url": "",
  "lang": "en",
  "axes": {
    "type": [
      "clinical",
      "everyday"
    ],
    "condition": [
      "General"
    ],
    "clinical_section": [
      "screening_cues"
    ],
    "life_topics": [
      "relationships"
    ],
    "advice_section": [],
    "audience": [],
    "risk_band": "low"
  },
  "index_text": "General — Screening Cues General — Dấu hiệu sàng lọc 36 Neurodevelopmental Disorders Specific Learning Disorder Specific Learning Disorder A. Difficulties learning and using academic skills, as indicated by the presence of at least one of the following symptoms that have persisted for at least 6 months, despite the provision of interven- tions that target those difficulties: 1. Inaccurate or slow and effortful word reading (e.g., reads sin- gle words aloud incorrectly or slowly and hesitantly, fre- quently guesses words, has difficulty sounding out words). 2. Difficulty understanding the meaning of what is read (e.g., may read text accurately but not understand the sequence, re- lationships, inferences, or deeper meanings of what is read). 3. Difficulties with spelling (e.g., may add, omit, or substitute vowels or consonants). 4. Difficulties with written expression (e.g., makes multiple gram- matical or punctuation errors within sentences; employs poor paragraph organization; written expression of ideas lacks clarity). 5. Difficulties mastering number sense, number facts, or calcula- tion (e.g., has poor understanding of numbers, their magnitude, and relationships; counts on fingers to add single-digit numbers instead of recalling the math fact as peers do; gets lost in the midst of arithmetic computation and may switch procedures). 6. Difficulties with mathematical reasoning (e.g., has severe dif- ficulty applying mathematical concepts, facts, or procedures to solve quantitative problems). B. The affected academic skills are substantially and quantifiably be- low those expected for the individual’s chronological age, and cause significant interference with academic or occupational per- formance, or with activities of daily living, as confirmed by indi- vidually administered standardized achievement measures and comprehensive clinical assessment. For individuals age 17 years and older, a documented history of 36 neurodevelopmental disorders specific learning disorder specific learning disorder a. difficulties learning and using academic skills, as indicated by the presence of at least one of the following symptoms that have p..."
}