{
  "id": "mhgap#management_cc8967b5",
  "title_en": "General — Management",
  "title_vi": "General — Management",
  "text_en": "and revised mhGAP guidelines were carers, and to bridge the gap between available resources and the large need for these published in 2015. We are now pleased to present mhGAP-IG Version 2.0 which not only services, the WHO Department of Mental Health and Substance Abuse launched the reflects these updates but also extensive feedback from the field to enhance the guide Mental Health Gap Action Programme (mhGAP) in 2008. The key objectives of mhGAP in its clarity and usability. are to reinforce the commitment of governments, international organizations and other stakeholders to increase the allocation of financial and human resources for care It is our hope that this guide will continue to be a key technical tool to deliver of MNS disorders and to achieve much higher coverage with key interventions in low- care for people with MNS disorders around the world and lead us closer to achieving and middle-income countries. Through these objectives, mhGAP provides evidence-based the goal of Universal Health Coverage. guidance and tools to advance toward achieving the targets of the Comprehensive Mental Health Action Plan 2013-2020. Shekhar Saxena In 2010, the mhGAP Intervention Guide (mhGAP-IG) for MNS disorders for non- Director, Department of Mental Health and Substance Abuse specialized health settings was developed to assist in implementation of mhGAP. A World Health Organization simple technical tool based on the mhGAP guidelines, mhGAP-IG presents integrated management of priority MNS conditions using protocols for clinical decision-making. There is a widely shared but false notion that all mental health interventions are complex and can only be delivered by highly specialized staff. Research in recent years has demonstrated the feasibility of delivery of pharmacological and psychosocial iii",
  "gloss_vi": "And revised mhgap guidelines were carers, and to bridge the gap between available resources and the large need for these published in 2015. we are now pleased to present mhgap-ig version 2.0 which not only services, the ...",
  "source": "WHO mhGAP-IG 2023",
  "url": "https://www.who.int/",
  "lang": "en",
  "axes": {
    "type": [
      "clinical"
    ],
    "condition": [
      "General"
    ],
    "clinical_section": [
      "management"
    ],
    "life_topics": [],
    "advice_section": [],
    "audience": [],
    "risk_band": "low"
  },
  "index_text": "General — Management General — Management and revised mhGAP guidelines were carers, and to bridge the gap between available resources and the large need for these published in 2015. We are now pleased to present mhGAP-IG Version 2.0 which not only services, the WHO Department of Mental Health and Substance Abuse launched the reflects these updates but also extensive feedback from the field to enhance the guide Mental Health Gap Action Programme (mhGAP) in 2008. The key objectives of mhGAP in its clarity and usability. are to reinforce the commitment of governments, international organizations and other stakeholders to increase the allocation of financial and human resources for care It is our hope that this guide will continue to be a key technical tool to deliver of MNS disorders and to achieve much higher coverage with key interventions in low- care for people with MNS disorders around the world and lead us closer to achieving and middle-income countries. Through these objectives, mhGAP provides evidence-based the goal of Universal Health Coverage. guidance and tools to advance toward achieving the targets of the Comprehensive Mental Health Action Plan 2013-2020. Shekhar Saxena In 2010, the mhGAP Intervention Guide (mhGAP-IG) for MNS disorders for non- Director, Department of Mental Health and Substance Abuse specialized health settings was developed to assist in implementation of mhGAP. A World Health Organization simple technical tool based on the mhGAP guidelines, mhGAP-IG presents integrated management of priority MNS conditions using protocols for clinical decision-making. There is a widely shared but false notion that all mental health interventions are complex and can only be delivered by highly specialized staff. Research in recent years has demonstrated the feasibility of delivery of pharmacological and psychosocial iii And revised mhgap guidelines were carers, and to bridge the gap between available resources and the large need for these published in 2015. we are now pleased to present mhgap-ig version 2.0 which not only services, the ..."
}