{
  "id": "mhgap#screening_cues_881260f5",
  "title_en": "General — Screening Cues",
  "title_vi": "General — Dấu hiệu sàng lọc",
  "text_en": "mhGAP-IG train the trainers: mhGAP-IG support & supervison: Ensure that the supply of medicine, medical equipment and other support systems for mhGAP-IG implementation are The objective is to ensure that trainers are skilled and confident Participants in the mhGAP-IG training course (mhGAP-IG operational. trainees) are usually non-specialized health care staff working in in their ability to train non-specialist healthcare providers and Demonstrate and encourage respectful, non-judgmental primary or secondary health care clinics/hospitals. They require act as informed resources for these providers. attitudes and ethical treatment that promotes and protects ongoing help to transfer what they have learned in training to the human rights of individuals with MNS conditions. their clinical practices. Supervision is seen as part of the mhGAP-IG trainers/supervisors should have the following characteristics: continuum of education required to create competent mhGAP Provide support to healthcare providers experiencing stress. health care providers. Support and supervision not only aims Be specialists in MNS health care (psychiatrist, psychiatric to assist mhGAP-IG trainees to deliver improved mental health nurse, neurologist, etc.), physicians or nurses trained and care (clinical supervision) but also provides support in the work experienced in managing MNS conditions using mhGAP-IG, environment related to mhGAP-IG implementation (administra- and/or existing supervisors for the general health system. tive and program supervision). Have clinical skills and experience in mental health and/or management of MNS conditions. Specific goals of support & supervision: Have skills and experience with administrative aspects of managing MNS conditions, including record keeping, Assist in the transfer of skills and knowledge from the follow-up and referral. mhGAP-IG training into clinical practice. Be good facilitators and problem-solvers. Ensure adequate delivery of mental health interventions that in line with mhGAP-IG and address areas for further skills Available for support and supervision, including regular development. supervisory visits. Identify and assist with problems faced by mhGAP-IG The training agenda: trainees in managing complicated clinical situations. The trainers are expected to conduct future mhGAP-IG training Help motivate non-specialized health care workers to provide courses and provide support and supervision to health care good quality care for people with MNS conditions. providers. Apart from training in the assessment and manage- ment of people with MNS conditions, as described in the Ensure necessary records and administrative procedures mhGAP-IG, they will learn about methods of training, planning for MNS conditions, such as referrals and follow-up, are of curricula, methods of supervision and quality assurance. established and/or integrated into existing systems at the local health care facilities. IMPLEMENTATION OF mhGAP-IG 155 156 IMP IMPLEMENTATION OF mhGAP-IG 16. Monitoring & Evaluation Monitoring and Evaluation (M&E) can provide information about Evaluate the mhGAP-IG implementation process, identify There are four main groups of medications that target priority whether a programme is making a difference and for whom; it can successes as well as needs for improvement and update the MNS conditions mentioned in this guide: identify programme areas that are on target or aspects of a pro- situation analysis. antipsychotics for psychotic disorders; gramme that need to be adjusted. Information gained from M&E can demonstrate to programme implementers and funders that drugs used in mood disorders (depressive or bipolar); In addition to the six actions described above, there are three their investments are paying off. M&E provides vital information continuous activities that form an essential part of mhGAP-IG anticonvulsants/antiepileptics; for learning from past experiences, improving service delivery, implementation. These are described in the sections below. planning, resource allocation",
  "gloss_vi": "Mhgap-ig train the trainers: mhgap-ig hỗ trợ & supervison: ensure that the supply of medicine, medical equipment and other hỗ trợ systems for mhgap-ig implementation are the objective is to ensure that trainers are skill...",
  "source": "WHO mhGAP-IG 2023",
  "url": "https://www.who.int/",
  "lang": "en",
  "axes": {
    "type": [
      "clinical",
      "everyday"
    ],
    "condition": [
      "General"
    ],
    "clinical_section": [
      "screening_cues",
      "referral",
      "psychoeducation",
      "management"
    ],
    "life_topics": [
      "stress",
      "work"
    ],
    "advice_section": [],
    "audience": [],
    "risk_band": "low"
  },
  "index_text": "General — Screening Cues General — Dấu hiệu sàng lọc mhGAP-IG train the trainers: mhGAP-IG support & supervison: Ensure that the supply of medicine, medical equipment and other support systems for mhGAP-IG implementation are The objective is to ensure that trainers are skilled and confident Participants in the mhGAP-IG training course (mhGAP-IG operational. trainees) are usually non-specialized health care staff working in in their ability to train non-specialist healthcare providers and Demonstrate and encourage respectful, non-judgmental primary or secondary health care clinics/hospitals. They require act as informed resources for these providers. attitudes and ethical treatment that promotes and protects ongoing help to transfer what they have learned in training to the human rights of individuals with MNS conditions. their clinical practices. Supervision is seen as part of the mhGAP-IG trainers/supervisors should have the following characteristics: continuum of education required to create competent mhGAP Provide support to healthcare providers experiencing stress. health care providers. Support and supervision not only aims Be specialists in MNS health care (psychiatrist, psychiatric to assist mhGAP-IG trainees to deliver improved mental health nurse, neurologist, etc.), physicians or nurses trained and care (clinical supervision) but also provides support in the work experienced in managing MNS conditions using mhGAP-IG, environment related to mhGAP-IG implementation (administra- and/or existing supervisors for the general health system. tive and program supervision). Have clinical skills and experience in mental health and/or management of MNS conditions. Specific goals of support & supervision: Have skills and experience with administrative aspects of managing MNS conditions, including record keeping, Assist in the transfer of skills and knowledge from the follow-up and referral. mhGAP-IG training into clinical practice. Be good facilitators and problem-solvers. Ensure adequate delivery of mental health interventions that in line with mhGAP-IG and address areas for further skills Available for support and supervision, including regular development. supervisory visits. Identify and assist with problems faced by mhGAP-IG The training agenda: trainees in managing complicated clinical situations. The trainers are expected to conduct future mhGAP-IG training Help motivate non-specialized health care workers to provide courses and provide support and supervision to health care good quality care for people with MNS conditions. providers. Apart from training in the assessment and manage- ment of people with MNS conditions, as described in the Ensure necessary records and administrative procedures mhGAP-IG, they will learn about methods of training, planning for MNS conditions, such as referrals and follow-up, are of curricula, methods of supervision and quality assurance. established and/or integrated into existing systems at the local health care facilities. IMPLEMENTATION OF mhGAP-IG 155 156 IMP IMPLEMENTATION OF mhGAP-IG 16. Monitoring & Evaluation Monitoring and Evaluation (M&E) can provide information about Evaluate the mhGAP-IG implementation process, identify There are four main groups of medications that target priority whether a programme is making a difference and for whom; it can successes as well as needs for improvement and update the MNS conditions mentioned in this guide: identify programme areas that are on target or aspects of a pro- situation analysis. antipsychotics for psychotic disorders; gramme that need to be adjusted. Information gained from M&E can demonstrate to programme implementers and funders that drugs used in mood disorders (depressive or bipolar); In addition to the six actions described above, there are three their investments are paying off. M&E provides vital information continuous activities that form an essential part of mhGAP-IG anticonvulsants/antiepileptics; for learning from past experiences, improving service delivery, implementation. These are described in the sections below. planning, resource allocation Mhgap-ig train the trainers: mhgap-ig hỗ trợ & supervison: ensure that the supply of medicine, medical equipment and other hỗ trợ systems for mhgap-ig implementation are the objective is to ensure that trainers are skill..."
}