{
  "id": "mhgap#psychoeducation_a1752862",
  "title_en": "General — Psychoeducation",
  "title_vi": "General — Giáo dục tâm lý",
  "text_en": "Check pupils. Normal pupils Pinpoint pupils Suspect Opioid overdose less likely – OPIOID OVERDOSE consider overdose of alcohol, other sedatives, or other medical causes (i.e. head injury, infection, or hypoglycemia). Give i.v., intramuscular (i.m.), intranasal or subcutaneous naloxone 0.4-2 mg. Continue respiratory support. Did the person respond to naloxone within 2 minutes? GIVE A SECOND DOSE Observe for 1-2 hours and repeat naloxone as needed. Observe the person until fully recovered or transported to hospital. Continue to resuscitate and observe the person until fully recovered or transported to hospital. DISORDERS DUE TO SUBSTANCE USE 109 110 SUB DISORDERS DUE TO SUBSTANCE USE 2 Does the person appear overstimulated, anxious, or agitated? SSSKKKIIIPPP tttooo SSSTTTEEEPPP 11111300000 ASSESS AND MANAGE A – D A Person has recently stopped MANAGE WITHDRAWAL Suspect drinking or using sedatives and is – If the person has tremors, sweating, or vital sign changes then give ALCOHOL or now showing any of the following diazepam 10-20 mg orally (p.o.) and transfer to hospital or detoxification BENZODIAZEPINE signs: Tremors, sweating, vomiting, facility if possible. WITHDRAWAL increased blood pressure (BP) & heart – Observe and repeat doses as needed for continued signs of rate, and agitation. withdrawal (tremors, sweating, increased BP and heart rate). – For alcohol withdrawal only: Give thiamine 100 mg daily for five days. TRANSFER IMMEDIATELY TO A HOSPITAL if the following are present: – Other serious medical problems, e.g. hepatic encephalopathy, gastrointestinal bleeding, or head injury. – Seizures: give diazepam 10-20 mg p.o., i.v. or rectum (p.r.) first. – Delirium: give diazepam 10-20 mg p.o., i.v. or p.r. first. If severe and not responsive to diazepam, give an anti-psychotic medication such as haloperidol 1-2.5 mg p.o. or i.m. Continue to treat other signs of withdrawal (tremors, sweating, vital signs changes) with diazepam p.o., i.v. or p.r.",
  "gloss_vi": "Check pupils. normal pupils pinpoint pupils suspect opioid overdose less likely – opioid overdose consider overdose of alcohol, other sedatives, or other medical causes (i.e.",
  "source": "WHO mhGAP-IG 2023",
  "url": "https://www.who.int/",
  "lang": "en",
  "axes": {
    "type": [
      "clinical"
    ],
    "condition": [
      "General"
    ],
    "clinical_section": [
      "psychoeducation"
    ],
    "life_topics": [],
    "advice_section": [],
    "audience": [],
    "risk_band": "low"
  },
  "index_text": "General — Psychoeducation General — Giáo dục tâm lý Check pupils. Normal pupils Pinpoint pupils Suspect Opioid overdose less likely – OPIOID OVERDOSE consider overdose of alcohol, other sedatives, or other medical causes (i.e. head injury, infection, or hypoglycemia). Give i.v., intramuscular (i.m.), intranasal or subcutaneous naloxone 0.4-2 mg. Continue respiratory support. Did the person respond to naloxone within 2 minutes? GIVE A SECOND DOSE Observe for 1-2 hours and repeat naloxone as needed. Observe the person until fully recovered or transported to hospital. Continue to resuscitate and observe the person until fully recovered or transported to hospital. DISORDERS DUE TO SUBSTANCE USE 109 110 SUB DISORDERS DUE TO SUBSTANCE USE 2 Does the person appear overstimulated, anxious, or agitated? SSSKKKIIIPPP tttooo SSSTTTEEEPPP 11111300000 ASSESS AND MANAGE A – D A Person has recently stopped MANAGE WITHDRAWAL Suspect drinking or using sedatives and is – If the person has tremors, sweating, or vital sign changes then give ALCOHOL or now showing any of the following diazepam 10-20 mg orally (p.o.) and transfer to hospital or detoxification BENZODIAZEPINE signs: Tremors, sweating, vomiting, facility if possible. WITHDRAWAL increased blood pressure (BP) & heart – Observe and repeat doses as needed for continued signs of rate, and agitation. withdrawal (tremors, sweating, increased BP and heart rate). – For alcohol withdrawal only: Give thiamine 100 mg daily for five days. TRANSFER IMMEDIATELY TO A HOSPITAL if the following are present: – Other serious medical problems, e.g. hepatic encephalopathy, gastrointestinal bleeding, or head injury. – Seizures: give diazepam 10-20 mg p.o., i.v. or rectum (p.r.) first. – Delirium: give diazepam 10-20 mg p.o., i.v. or p.r. first. If severe and not responsive to diazepam, give an anti-psychotic medication such as haloperidol 1-2.5 mg p.o. or i.m. Continue to treat other signs of withdrawal (tremors, sweating, vital signs changes) with diazepam p.o., i.v. or p.r. Check pupils. normal pupils pinpoint pupils suspect opioid overdose less likely – opioid overdose consider overdose of alcohol, other sedatives, or other medical causes (i.e."
}