{
  "id": "everyday#screening_cues_5d4908e9",
  "title_en": "General — Screening Cues",
  "title_vi": "General — Dấu hiệu sàng lọc",
  "text_en": "of an independent sexual dysfunction could include the following: The symptoms precede the onset of the substance/medica- tion use; the symptoms persist for a substantial period of time (e.g., about 1 month) after the cessation of acute with- drawal or severe intoxication; or there is other evidence sug- gesting the existence of an independent non-substance/ medication-induced sexual dysfunction (e.g., a history of re- current non-substance/medication-related episodes). D. The disturbance does not occur exclusively during the course of a delirium. E. The disturbance causes clinically significant distress in the indi- vidual. Note: This diagnosis should be made instead of a diagnosis of sub- stance intoxication or substance withdrawal only when the symptoms in Criterion A predominate in the clinical picture and are sufficiently severe to warrant clinical attention. Coding note: The ICD-9-CM and ICD-10-CM codes for the [specific substance/medication]-induced sexual dysfunctions are indicated in the table below. Note that the ICD-10-CM code depends on whether or not there is a comorbid substance use disorder present for the same class of substance. If a mild substance use disorder is comorbid with the substance-induced sexual dysfunction, the 4th position character is “1,” and the clinician should record “mild [substance] use disorder” before the substance-induced sexual dysfunction (e.g., “mild cocaine use disorder with cocaine-induced sexual dysfunction”). If a moderate or severe substance use disorder is comorbid with the substance- induced sexual dysfunction, the 4th position character is “2,” and the clinician should record “moderate [substance] use disorder” or “severe [substance] use disorder” depending on the severity of the comorbid substance use disorder. If there is no comorbid substance use disor-",
  "gloss_vi": "Of an independent sexual dysfunction could include the following: the symptoms precede the onset of the substance/medica- tion use; the symptoms persist for a substantial period of time (e.g., about 1 month) after the ce...",
  "source": "Everyday Essentials",
  "url": "",
  "lang": "en",
  "axes": {
    "type": [
      "clinical",
      "everyday"
    ],
    "condition": [
      "General"
    ],
    "clinical_section": [
      "screening_cues"
    ],
    "life_topics": [
      "stress"
    ],
    "advice_section": [],
    "audience": [],
    "risk_band": "low"
  },
  "index_text": "General — Screening Cues General — Dấu hiệu sàng lọc of an independent sexual dysfunction could include the following: The symptoms precede the onset of the substance/medica- tion use; the symptoms persist for a substantial period of time (e.g., about 1 month) after the cessation of acute with- drawal or severe intoxication; or there is other evidence sug- gesting the existence of an independent non-substance/ medication-induced sexual dysfunction (e.g., a history of re- current non-substance/medication-related episodes). D. The disturbance does not occur exclusively during the course of a delirium. E. The disturbance causes clinically significant distress in the indi- vidual. Note: This diagnosis should be made instead of a diagnosis of sub- stance intoxication or substance withdrawal only when the symptoms in Criterion A predominate in the clinical picture and are sufficiently severe to warrant clinical attention. Coding note: The ICD-9-CM and ICD-10-CM codes for the [specific substance/medication]-induced sexual dysfunctions are indicated in the table below. Note that the ICD-10-CM code depends on whether or not there is a comorbid substance use disorder present for the same class of substance. If a mild substance use disorder is comorbid with the substance-induced sexual dysfunction, the 4th position character is “1,” and the clinician should record “mild [substance] use disorder” before the substance-induced sexual dysfunction (e.g., “mild cocaine use disorder with cocaine-induced sexual dysfunction”). If a moderate or severe substance use disorder is comorbid with the substance- induced sexual dysfunction, the 4th position character is “2,” and the clinician should record “moderate [substance] use disorder” or “severe [substance] use disorder” depending on the severity of the comorbid substance use disorder. If there is no comorbid substance use disor- Of an independent sexual dysfunction could include the following: the symptoms precede the onset of the substance/medica- tion use; the symptoms persist for a substantial period of time (e.g., about 1 month) after the ce..."
}