{
  "id": "everyday#referral_0ae82faa",
  "title_en": "General — Referral",
  "title_vi": "General — Chuyển tuyến",
  "text_en": "Gender Dysphoria Gender Dysphoria Gender Dysphoria in Children 302.6 (F64.2) A. A marked incongruence between one’s experienced/expressed gender and assigned gender, of at least 6 months’ duration, as manifested by at least six of the following (one of which must be Criterion A1): 1. A strong desire to be of the other gender or an insistence that he or she is the other gender (or some alternative gender dif- ferent from one’s assigned gender). 2. In boys (assigned gender), a strong preference for cross- dressing or simulating female attire; or in girls (assigned gen- der), a strong preference for wearing only typical masculine clothing and a strong resistance to the wearing of typical feminine clothing. 3. A strong preference for cross-gender roles in make-believe play or fantasy play. 4. A strong preference for the toys, games, or activities stereo- typically used or engaged in by the other gender. 5. A strong preference for playmates of the other gender. 6. In boys (assigned gender), a strong rejection of typically mas- culine toys, games, and activities and a strong avoidance of rough-and-tumble play; or in girls (assigned gender), a strong rejection of typically feminine toys, games, and activities. 7. A strong dislike of one’s sexual anatomy. 8. A strong desire for the primary and/or secondary sex charac- teristics that match one’s experienced gender. B. The condition is associated with clinically significant distress or im- pairment in social, school, or other important areas of functioning. 215 216",
  "gloss_vi": "Gender dysphoria gender dysphoria gender dysphoria in children 302.6 (f64.2) a. a marked incongruence between one’s experienced/expressed gender and assigned gender, of at least 6 months’ duration, as manifested by at le...",
  "source": "Everyday Essentials",
  "url": "",
  "lang": "en",
  "axes": {
    "type": [
      "clinical",
      "everyday"
    ],
    "condition": [
      "General"
    ],
    "clinical_section": [
      "referral",
      "do_not_do"
    ],
    "life_topics": [
      "stress"
    ],
    "advice_section": [],
    "audience": [],
    "risk_band": "low"
  },
  "index_text": "General — Referral General — Chuyển tuyến Gender Dysphoria Gender Dysphoria Gender Dysphoria in Children 302.6 (F64.2) A. A marked incongruence between one’s experienced/expressed gender and assigned gender, of at least 6 months’ duration, as manifested by at least six of the following (one of which must be Criterion A1): 1. A strong desire to be of the other gender or an insistence that he or she is the other gender (or some alternative gender dif- ferent from one’s assigned gender). 2. In boys (assigned gender), a strong preference for cross- dressing or simulating female attire; or in girls (assigned gen- der), a strong preference for wearing only typical masculine clothing and a strong resistance to the wearing of typical feminine clothing. 3. A strong preference for cross-gender roles in make-believe play or fantasy play. 4. A strong preference for the toys, games, or activities stereo- typically used or engaged in by the other gender. 5. A strong preference for playmates of the other gender. 6. In boys (assigned gender), a strong rejection of typically mas- culine toys, games, and activities and a strong avoidance of rough-and-tumble play; or in girls (assigned gender), a strong rejection of typically feminine toys, games, and activities. 7. A strong dislike of one’s sexual anatomy. 8. A strong desire for the primary and/or secondary sex charac- teristics that match one’s experienced gender. B. The condition is associated with clinically significant distress or im- pairment in social, school, or other important areas of functioning. 215 216 Gender dysphoria gender dysphoria gender dysphoria in children 302.6 (f64.2) a. a marked incongruence between one’s experienced/expressed gender and assigned gender, of at least 6 months’ duration, as manifested by at le..."
}