{
  "id": "everyday#screening_cues_16e99997",
  "title_en": "General — Screening Cues",
  "title_vi": "General — Dấu hiệu sàng lọc",
  "text_en": "presentation does not meet the criteria for any specific trauma- and stressor- related disorder. This is done by recording “other specified trauma- and stressor-related disorder” followed by the specific reason (e.g., “persistent complex bereavement disorder”). Examples of presentations that can be specified using the “other specified” designation include the following: 1. Adjustment-like disorders with delayed onset of symptoms that occur more than 3 months after the stressor. 2. Adjustment-like disorders with prolonged duration of more than 6 months without prolonged duration of stressor. 3. Ataque de nervios: See “Glossary of Cultural Concepts of Dis- tress” in the Appendix to DSM-5. 4. Other cultural syndromes: See “Glossary of Cultural Concepts of Distress” in the Appendix to DSM-5. 5. Persistent complex bereavement disorder: This disorder is characterized by severe and persistent grief and mourning reac- tions (see the chapter “Conditions for Further Study” in Section III of DSM-5). Unspecified Trauma- and Stressor-Related Disorder 309.9 (F43.9) This category applies to presentations in which symptoms character- istic of a trauma- and stressor-related disorder that cause clinically significant distress or impairment in social, occupational, or other im- portant areas of functioning predominate but do not meet the full cri- teria for any of the disorders in the trauma- and stressor-related disorders diagnostic class. The unspecified trauma- and stressor- related disorder category is used in situations in which the clinician chooses not to specify the reason that the criteria are not met for a specific trauma- and stressor-related disorder, and includes presen- tations in which there is insufficient information to make a more spe- cific diagnosis (e.g., in emergency room settings).",
  "gloss_vi": "Presentation does not meet the criteria for any specific trauma- and stressor- related disorder. this is done by recording “other specified trauma- and stressor-related disorder” followed by the specific reason (e.g., “p...",
  "source": "Everyday Essentials",
  "url": "",
  "lang": "en",
  "axes": {
    "type": [
      "clinical",
      "everyday"
    ],
    "condition": [
      "General"
    ],
    "clinical_section": [
      "screening_cues",
      "do_not_do"
    ],
    "life_topics": [
      "stress",
      "study",
      "grief"
    ],
    "advice_section": [],
    "audience": [],
    "risk_band": "low"
  },
  "index_text": "General — Screening Cues General — Dấu hiệu sàng lọc presentation does not meet the criteria for any specific trauma- and stressor- related disorder. This is done by recording “other specified trauma- and stressor-related disorder” followed by the specific reason (e.g., “persistent complex bereavement disorder”). Examples of presentations that can be specified using the “other specified” designation include the following: 1. Adjustment-like disorders with delayed onset of symptoms that occur more than 3 months after the stressor. 2. Adjustment-like disorders with prolonged duration of more than 6 months without prolonged duration of stressor. 3. Ataque de nervios: See “Glossary of Cultural Concepts of Dis- tress” in the Appendix to DSM-5. 4. Other cultural syndromes: See “Glossary of Cultural Concepts of Distress” in the Appendix to DSM-5. 5. Persistent complex bereavement disorder: This disorder is characterized by severe and persistent grief and mourning reac- tions (see the chapter “Conditions for Further Study” in Section III of DSM-5). Unspecified Trauma- and Stressor-Related Disorder 309.9 (F43.9) This category applies to presentations in which symptoms character- istic of a trauma- and stressor-related disorder that cause clinically significant distress or impairment in social, occupational, or other im- portant areas of functioning predominate but do not meet the full cri- teria for any of the disorders in the trauma- and stressor-related disorders diagnostic class. The unspecified trauma- and stressor- related disorder category is used in situations in which the clinician chooses not to specify the reason that the criteria are not met for a specific trauma- and stressor-related disorder, and includes presen- tations in which there is insufficient information to make a more spe- cific diagnosis (e.g., in emergency room settings). Presentation does not meet the criteria for any specific trauma- and stressor- related disorder. this is done by recording “other specified trauma- and stressor-related disorder” followed by the specific reason (e.g., “p..."
}