{
  "id": "everyday#general_b59d5286",
  "title_en": "General — General",
  "title_vi": "General — General",
  "text_en": "by one-time use of a substance or medication). Additional information needed to record the diagnostic name of the substance/medication-induced mental dis- order is provided in the section “Recording Procedures” for each sub- stance/medication-induced mental disorder in its respective chapter. Alcohol Use Disorder 233 Alcohol-Related Disorders Alcohol Use Disorder A. A problematic pattern of alcohol use leading to clinically signifi- cant impairment or distress, as manifested by at least two of the following, occurring within a 12-month period: 1. Alcohol is often taken in larger amounts or over a longer pe- riod than was intended. 2. There is a persistent desire or unsuccessful efforts to cut down or control alcohol use. 3. A great deal of time is spent in activities necessary to obtain alcohol, use alcohol, or recover from its effects. 4. Craving, or a strong desire or urge to use alcohol. 5. Recurrent alcohol use resulting in a failure to fulfill major role obligations at work, school, or home. 6. Continued alcohol use despite having persistent or recurrent social or interpersonal problems caused or exacerbated by the effects of alcohol. 7. Important social, occupational, or recreational activities are given up or reduced because of alcohol use. 8. Recurrent alcohol use in situations in which it is physically hazardous. 9. Alcohol use is continued despite knowledge of having a per- sistent or recurrent physical or psychological problem that is likely to have been caused or exacerbated by alcohol. 10. Tolerance, as defined by either of the following: a. A need for markedly increased amounts of alcohol to achieve intoxication or desired effect. b. A markedly diminished effect with continued use of the same amount of alcohol.",
  "gloss_vi": "By one-time use of a substance or medication). additional information needed to record the diagnostic name of the substance/medication-induced mental dis- order is provided in the section “recording procedures” for each ...",
  "source": "Everyday Essentials",
  "url": "",
  "lang": "en",
  "axes": {
    "type": [
      "everyday"
    ],
    "condition": [
      "General"
    ],
    "clinical_section": [],
    "life_topics": [
      "stress",
      "work"
    ],
    "advice_section": [],
    "audience": [],
    "risk_band": "low"
  },
  "index_text": "General — General General — General by one-time use of a substance or medication). Additional information needed to record the diagnostic name of the substance/medication-induced mental dis- order is provided in the section “Recording Procedures” for each sub- stance/medication-induced mental disorder in its respective chapter. Alcohol Use Disorder 233 Alcohol-Related Disorders Alcohol Use Disorder A. A problematic pattern of alcohol use leading to clinically signifi- cant impairment or distress, as manifested by at least two of the following, occurring within a 12-month period: 1. Alcohol is often taken in larger amounts or over a longer pe- riod than was intended. 2. There is a persistent desire or unsuccessful efforts to cut down or control alcohol use. 3. A great deal of time is spent in activities necessary to obtain alcohol, use alcohol, or recover from its effects. 4. Craving, or a strong desire or urge to use alcohol. 5. Recurrent alcohol use resulting in a failure to fulfill major role obligations at work, school, or home. 6. Continued alcohol use despite having persistent or recurrent social or interpersonal problems caused or exacerbated by the effects of alcohol. 7. Important social, occupational, or recreational activities are given up or reduced because of alcohol use. 8. Recurrent alcohol use in situations in which it is physically hazardous. 9. Alcohol use is continued despite knowledge of having a per- sistent or recurrent physical or psychological problem that is likely to have been caused or exacerbated by alcohol. 10. Tolerance, as defined by either of the following: a. A need for markedly increased amounts of alcohol to achieve intoxication or desired effect. b. A markedly diminished effect with continued use of the same amount of alcohol. By one-time use of a substance or medication). additional information needed to record the diagnostic name of the substance/medication-induced mental dis- order is provided in the section “recording procedures” for each ..."
}