{
  "id": "everyday#screening_cues_f37dbac9",
  "title_en": "General — Screening Cues",
  "title_vi": "General — Dấu hiệu sàng lọc",
  "text_en": "a week and/or for less than 3 months. 176 Feeding and Eating Disorders 3. Binge-eating disorder (of low frequency and/or limited dura- tion): All of the criteria for binge-eating disorder are met, except that the binge eating occurs, on average, less than once a week and/or for less than 3 months. 4. Purging disorder: Recurrent purging behavior to influence weight or shape (e.g., self-induced vomiting; misuse of laxatives, diuretics, or other medications) in the absence of binge eating. 5. Night eating syndrome: Recurrent episodes of night eating, as manifested by eating after awakening from sleep or by excessive food consumption after the evening meal. There is awareness and recall of the eating. The night eating is not better explained by ex- ternal influences such as changes in the individual’s sleep-wake cycle or by local social norms. The night eating causes significant distress and/or impairment in functioning. The disordered pattern of eating is not better explained by binge-eating disorder or an- other mental disorder, including substance use, and is not attribut- able to another medical disorder or to an effect of medication. Unspecified Feeding or Eating Disorder 307.50 (F50.9) This category applies to presentations in which symptoms character- istic of a feeding and eating disorder that cause clinically significant distress or impairment in social, occupational, or other important ar- eas of functioning predominate but do not meet the full criteria for any of the disorders in the feeding and eating disorders diagnostic class. The unspecified feeding or eating disorder category is used in situa- tions in which the clinician chooses not to specify the reason that the criteria are not met for a specific feeding and eating disorder, and in- cludes presentations in which there is insufficient information to make a more specific diagnosis (e.g., in emergency room settings).",
  "gloss_vi": "A week and/or for less than 3 months. 176 feeding and eating disorders 3.",
  "source": "Everyday Essentials",
  "url": "",
  "lang": "en",
  "axes": {
    "type": [
      "clinical",
      "everyday"
    ],
    "condition": [
      "General"
    ],
    "clinical_section": [
      "screening_cues",
      "do_not_do"
    ],
    "life_topics": [
      "sleep",
      "stress"
    ],
    "advice_section": [],
    "audience": [],
    "risk_band": "low"
  },
  "index_text": "General — Screening Cues General — Dấu hiệu sàng lọc a week and/or for less than 3 months. 176 Feeding and Eating Disorders 3. Binge-eating disorder (of low frequency and/or limited dura- tion): All of the criteria for binge-eating disorder are met, except that the binge eating occurs, on average, less than once a week and/or for less than 3 months. 4. Purging disorder: Recurrent purging behavior to influence weight or shape (e.g., self-induced vomiting; misuse of laxatives, diuretics, or other medications) in the absence of binge eating. 5. Night eating syndrome: Recurrent episodes of night eating, as manifested by eating after awakening from sleep or by excessive food consumption after the evening meal. There is awareness and recall of the eating. The night eating is not better explained by ex- ternal influences such as changes in the individual’s sleep-wake cycle or by local social norms. The night eating causes significant distress and/or impairment in functioning. The disordered pattern of eating is not better explained by binge-eating disorder or an- other mental disorder, including substance use, and is not attribut- able to another medical disorder or to an effect of medication. Unspecified Feeding or Eating Disorder 307.50 (F50.9) This category applies to presentations in which symptoms character- istic of a feeding and eating disorder that cause clinically significant distress or impairment in social, occupational, or other important ar- eas of functioning predominate but do not meet the full criteria for any of the disorders in the feeding and eating disorders diagnostic class. The unspecified feeding or eating disorder category is used in situa- tions in which the clinician chooses not to specify the reason that the criteria are not met for a specific feeding and eating disorder, and in- cludes presentations in which there is insufficient information to make a more specific diagnosis (e.g., in emergency room settings). A week and/or for less than 3 months. 176 feeding and eating disorders 3."
}