{
  "id": "everyday#general_b65e6c77",
  "title_en": "General — General",
  "title_vi": "General — General",
  "text_en": "Personality Disorders General Personality Disorder A. An enduring pattern of inner experience and behavior that devi- ates markedly from the expectations of the individual’s culture. This pattern is manifested in two (or more) of the following areas: 1. Cognition (i.e., ways of perceiving and interpreting self, other people, and events). 2. Affectivity (i.e., the range, intensity, lability, and appropriate- ness of emotional response). 3. Interpersonal functioning. 4. Impulse control. B. The enduring pattern is inflexible and pervasive across a broad range of personal and social situations. C. The enduring pattern leads to clinically significant distress or im- pairment in social, occupational, or other important areas of func- tioning. D. The pattern is stable and of long duration, and its onset can be traced back at least to adolescence or early adulthood. E. The enduring pattern is not better explained as a manifestation or consequence of another mental disorder. F. The enduring pattern is not attributable to the physiological effects of a substance (e.g., a drug of abuse, a medication) or another medical condition (e.g., head trauma). 321 322 Personality Disorders Cluster A Personality Disorders Paranoid Personality Disorder 301.0 (F60.0) A. A pervasive distrust and suspiciousness of others such that",
  "gloss_vi": "Personality disorders general personality disorder a. an enduring pattern of inner experience and behavior that devi- ates markedly from the expectations of the individual’s culture.",
  "source": "Everyday Essentials",
  "url": "",
  "lang": "en",
  "axes": {
    "type": [
      "everyday"
    ],
    "condition": [
      "General"
    ],
    "clinical_section": [],
    "life_topics": [
      "stress"
    ],
    "advice_section": [],
    "audience": [],
    "risk_band": "low"
  },
  "index_text": "General — General General — General Personality Disorders General Personality Disorder A. An enduring pattern of inner experience and behavior that devi- ates markedly from the expectations of the individual’s culture. This pattern is manifested in two (or more) of the following areas: 1. Cognition (i.e., ways of perceiving and interpreting self, other people, and events). 2. Affectivity (i.e., the range, intensity, lability, and appropriate- ness of emotional response). 3. Interpersonal functioning. 4. Impulse control. B. The enduring pattern is inflexible and pervasive across a broad range of personal and social situations. C. The enduring pattern leads to clinically significant distress or im- pairment in social, occupational, or other important areas of func- tioning. D. The pattern is stable and of long duration, and its onset can be traced back at least to adolescence or early adulthood. E. The enduring pattern is not better explained as a manifestation or consequence of another mental disorder. F. The enduring pattern is not attributable to the physiological effects of a substance (e.g., a drug of abuse, a medication) or another medical condition (e.g., head trauma). 321 322 Personality Disorders Cluster A Personality Disorders Paranoid Personality Disorder 301.0 (F60.0) A. A pervasive distrust and suspiciousness of others such that Personality disorders general personality disorder a. an enduring pattern of inner experience and behavior that devi- ates markedly from the expectations of the individual’s culture."
}