{
  "id": "everyday#screening_cues_49b8dfe4",
  "title_en": "General — Screening Cues",
  "title_vi": "General — Dấu hiệu sàng lọc",
  "text_en": "causes clinically significant distress or impairment in social, occupational, or other important areas of functioning. H. The disturbance is not attributable to the physiological effects of a substance (e.g., medication, alcohol) or another medical condition. Specify whether: With dissociative symptoms: The individual’s symptoms meet the criteria for posttraumatic stress disorder, and in addition, in response to the stressor, the individual experiences persistent or recurrent symptoms of either of the following: 1. Depersonalization: Persistent or recurrent experiences of feeling detached from, and as if one were an outside ob- server of, one’s mental processes or body (e.g., feeling as though one were in a dream; feeling a sense of unreality of self or body or of time moving slowly). 2. Derealization: Persistent or recurrent experiences of unre- ality of surroundings (e.g., the world around the individual is experienced as unreal, dreamlike, distant, or distorted). Note: To use this subtype, the dissociative symptoms must not be attributable to the physiological effects of a substance (e.g., blackouts, behavior during alcohol intoxication) or another med- ical condition (e.g., complex partial seizures). Specify if: With delayed expression: If the full diagnostic criteria are not met until at least 6 months after the event (although the onset and expression of some symptoms may be immediate). Posttraumatic Stress Disorder for Children 6 Years and Younger A. In children 6 years and younger, exposure to actual or threat- ened death, serious injury, or sexual violence in one (or more) of the following ways: 1. Directly experiencing the traumatic event(s). 2. Witnessing, in person, the event(s) as it occurred to others, especially primary caregivers. Note: Witnessing does not include events that are witnessed only in electronic media, television, movies, or pictures.",
  "gloss_vi": "Causes clinically significant distress or impairment in social, occupational, or other important areas of functioning. h.",
  "source": "Everyday Essentials",
  "url": "",
  "lang": "en",
  "axes": {
    "type": [
      "clinical",
      "everyday"
    ],
    "condition": [
      "General"
    ],
    "clinical_section": [
      "screening_cues",
      "caregiver"
    ],
    "life_topics": [
      "stress"
    ],
    "advice_section": [],
    "audience": [],
    "risk_band": "low"
  },
  "index_text": "General — Screening Cues General — Dấu hiệu sàng lọc causes clinically significant distress or impairment in social, occupational, or other important areas of functioning. H. The disturbance is not attributable to the physiological effects of a substance (e.g., medication, alcohol) or another medical condition. Specify whether: With dissociative symptoms: The individual’s symptoms meet the criteria for posttraumatic stress disorder, and in addition, in response to the stressor, the individual experiences persistent or recurrent symptoms of either of the following: 1. Depersonalization: Persistent or recurrent experiences of feeling detached from, and as if one were an outside ob- server of, one’s mental processes or body (e.g., feeling as though one were in a dream; feeling a sense of unreality of self or body or of time moving slowly). 2. Derealization: Persistent or recurrent experiences of unre- ality of surroundings (e.g., the world around the individual is experienced as unreal, dreamlike, distant, or distorted). Note: To use this subtype, the dissociative symptoms must not be attributable to the physiological effects of a substance (e.g., blackouts, behavior during alcohol intoxication) or another med- ical condition (e.g., complex partial seizures). Specify if: With delayed expression: If the full diagnostic criteria are not met until at least 6 months after the event (although the onset and expression of some symptoms may be immediate). Posttraumatic Stress Disorder for Children 6 Years and Younger A. In children 6 years and younger, exposure to actual or threat- ened death, serious injury, or sexual violence in one (or more) of the following ways: 1. Directly experiencing the traumatic event(s). 2. Witnessing, in person, the event(s) as it occurred to others, especially primary caregivers. Note: Witnessing does not include events that are witnessed only in electronic media, television, movies, or pictures. Causes clinically significant distress or impairment in social, occupational, or other important areas of functioning. h."
}