{
  "id": "icd11#referral_99fe85a3",
  "title_en": "General — Referral",
  "title_vi": "General — Chuyển tuyến",
  "text_en": "748 Clinical Descriptions and Diagnostic Requirements for ICD-11 Mental, Behavioural or Neurodevelopmental Disorders QE3Y Other specified problems associated with social insurance or welfare QE3Z Problems associated with social insurance or welfare, unspecified Problems associated with the justice system QE40 Problems associated with conviction in civil or criminal proceedings without imprisonment QE41 Problems associated with imprisonment and other incarceration QE42 Problems associated with release from prison QE4Y Other specified problems associated with the justice system QE4Z Problems associated with the justice system, unspecified Problems associated with finances QD50 Poverty QD51 Low income QD5Y Other specified problems associated with finances QD5Z Problems associated with finances, unspecified Reasons for contact with mental health services | Problems associated with the justice system/with finances Factors influencing health status or contact with health services particularly relevant to mental health services 749 Problems associated with inadequate drinking-water or nutrition QD60 Problems associated with inadequate drinking-water QD61 Inadequate food QD6Z Problems associated with drinking-water or nutrition, unspecified Problems associated with the environment QD70 Problems associated with the natural environment or human-made changes to the environment QD70.0 Problem associated with exposure to noise QD70.1 Problem associated with exposure to air pollution QD70.2 Problem associated with exposure to water pollution QD70.3 Problem associated with exposure to soil pollution QD70.4 Problem associated with exposure to exposure to radiation QD70.5 Problem associated with exposure to exposure to tobacco smoke Note: this refers to second-hand smoke, and not to tobacco use by the individual. QD70.6 Problem associated with inadequate access to electricity QD70.Z Problem associated with the natural environment or human-made changes to the environment, unspecified Problems associated with inadequate drinking-water, nutrition or the environment",
  "gloss_vi": "748 clinical descriptions and diagnostic requirements for icd-11 mental, behavioural or neurodevelopmental disorders qe3y other specified problems associated with social insurance or welfare qe3z problems associated with...",
  "source": "WHO ICD-11",
  "url": "https://icd.who.int/",
  "lang": "en",
  "axes": {
    "type": [
      "clinical"
    ],
    "condition": [
      "General"
    ],
    "clinical_section": [
      "referral"
    ],
    "life_topics": [],
    "advice_section": [],
    "audience": [],
    "risk_band": "low"
  },
  "index_text": "General — Referral General — Chuyển tuyến 748 Clinical Descriptions and Diagnostic Requirements for ICD-11 Mental, Behavioural or Neurodevelopmental Disorders QE3Y Other specified problems associated with social insurance or welfare QE3Z Problems associated with social insurance or welfare, unspecified Problems associated with the justice system QE40 Problems associated with conviction in civil or criminal proceedings without imprisonment QE41 Problems associated with imprisonment and other incarceration QE42 Problems associated with release from prison QE4Y Other specified problems associated with the justice system QE4Z Problems associated with the justice system, unspecified Problems associated with finances QD50 Poverty QD51 Low income QD5Y Other specified problems associated with finances QD5Z Problems associated with finances, unspecified Reasons for contact with mental health services | Problems associated with the justice system/with finances Factors influencing health status or contact with health services particularly relevant to mental health services 749 Problems associated with inadequate drinking-water or nutrition QD60 Problems associated with inadequate drinking-water QD61 Inadequate food QD6Z Problems associated with drinking-water or nutrition, unspecified Problems associated with the environment QD70 Problems associated with the natural environment or human-made changes to the environment QD70.0 Problem associated with exposure to noise QD70.1 Problem associated with exposure to air pollution QD70.2 Problem associated with exposure to water pollution QD70.3 Problem associated with exposure to soil pollution QD70.4 Problem associated with exposure to exposure to radiation QD70.5 Problem associated with exposure to exposure to tobacco smoke Note: this refers to second-hand smoke, and not to tobacco use by the individual. QD70.6 Problem associated with inadequate access to electricity QD70.Z Problem associated with the natural environment or human-made changes to the environment, unspecified Problems associated with inadequate drinking-water, nutrition or the environment 748 clinical descriptions and diagnostic requirements for icd-11 mental, behavioural or neurodevelopmental disorders qe3y other specified problems associated with social insurance or welfare qe3z problems associated with..."
}