{
  "id": "icd11#referral_6b8c1f49",
  "title_en": "General — Referral",
  "title_vi": "General — Chuyển tuyến",
  "text_en": "Mood disorders 211 Mood disorders Mood disorders is a superordinate grouping of bipolar disorders and depressive disorders. Mood disorders are defined according to particular types of mood episodes and their pattern over time. The primary types of mood episodes are: depressive episode manic episode mixed episode hypomanic episode. Mood episodes are not independently diagnosable entities, and therefore do not have their own diagnostic codes. Rather, mood episodes are the components of bipolar and related disorders and depressive disorders. Bipolar and related disorders include the following: 6A60 Bipolar type I disorder 6A61 Bipolar type II disorder 6A62 Cyclothymic disorder 6A6Y Other specified bipolar or related disorder 6A6Z Bipolar or related disorder, unspecified. Depressive disorders include the following: 6A70 Single episode depressive disorder 6A71 Recurrent depressive disorder 6A72 Dysthymic disorder 6A73 Mixed depressive and anxiety disorder 6A7Y Other specified depressive disorder 6A7Z Depressive disorder, unspecified. Mood disorders 212 Clinical Descriptions and Diagnostic Requirements for ICD-11 Mental, Behavioural or Neurodevelopmental Disorders CDDR are also provided for GA34.41 Premenstrual dysphoric disorder in the section on depressive disorders. Premenstrual dysphoric disorder is classified in the grouping of premenstrual disturbances in Chapter 16 on diseases of the genitourinary system, but is cross-listed here for reference. GA34.41 Premenstrual dysphoric disorder A category for mood disorders that do not fit the descriptions for any of the above categories is also provided (other specified), as is a category for use when it is not possible to make a more definitive diagnosis (unspecified):",
  "gloss_vi": "Mood disorders 211 mood disorders mood disorders is a superordinate grouping of bipolar disorders and depressive disorders. mood disorders are defined according to particular types of mood episodes and their pattern over...",
  "source": "WHO ICD-11",
  "url": "https://icd.who.int/",
  "lang": "en",
  "axes": {
    "type": [
      "clinical"
    ],
    "condition": [
      "General"
    ],
    "clinical_section": [
      "referral",
      "do_not_do"
    ],
    "life_topics": [],
    "advice_section": [],
    "audience": [],
    "risk_band": "low"
  },
  "index_text": "General — Referral General — Chuyển tuyến Mood disorders 211 Mood disorders Mood disorders is a superordinate grouping of bipolar disorders and depressive disorders. Mood disorders are defined according to particular types of mood episodes and their pattern over time. The primary types of mood episodes are: depressive episode manic episode mixed episode hypomanic episode. Mood episodes are not independently diagnosable entities, and therefore do not have their own diagnostic codes. Rather, mood episodes are the components of bipolar and related disorders and depressive disorders. Bipolar and related disorders include the following: 6A60 Bipolar type I disorder 6A61 Bipolar type II disorder 6A62 Cyclothymic disorder 6A6Y Other specified bipolar or related disorder 6A6Z Bipolar or related disorder, unspecified. Depressive disorders include the following: 6A70 Single episode depressive disorder 6A71 Recurrent depressive disorder 6A72 Dysthymic disorder 6A73 Mixed depressive and anxiety disorder 6A7Y Other specified depressive disorder 6A7Z Depressive disorder, unspecified. Mood disorders 212 Clinical Descriptions and Diagnostic Requirements for ICD-11 Mental, Behavioural or Neurodevelopmental Disorders CDDR are also provided for GA34.41 Premenstrual dysphoric disorder in the section on depressive disorders. Premenstrual dysphoric disorder is classified in the grouping of premenstrual disturbances in Chapter 16 on diseases of the genitourinary system, but is cross-listed here for reference. GA34.41 Premenstrual dysphoric disorder A category for mood disorders that do not fit the descriptions for any of the above categories is also provided (other specified), as is a category for use when it is not possible to make a more definitive diagnosis (unspecified): Mood disorders 211 mood disorders mood disorders is a superordinate grouping of bipolar disorders and depressive disorders. mood disorders are defined according to particular types of mood episodes and their pattern over..."
}