{
  "id": "icd11#management_f4992b9a",
  "title_en": "General — Management",
  "title_vi": "General — Management",
  "text_en": "80 Clinical Descriptions and Diagnostic Requirements for ICD-11 Mental, Behavioural or Neurodevelopmental Disorders Paraphilic disorders 6D30 Exhibitionistic disorder 6D31 Voyeuristic disorder 6D32 Paedophilic disorder 6D33 Coercive sexual sadism disorder 6D34 Frotteuristic disorder 6D35 Other paraphilic disorder involving non-consenting individuals 6D36 Paraphilic disorder involving solitary behaviour or consenting individuals 6D3Z Paraphilic disorder, unspecified Factitious disorders 6D50 Factitious disorder imposed on self 6D51 Factitious disorder imposed on another 6D5Z Factitious disorder, unspecified List of categories 81 Neurocognitive disorders 6D70 Delirium Specify identified cause: 6D70.0 Delirium due to disease classified elsewhere 6D70.1 Delirium due to psychoactive substances, including medications Specify substance class: (Note: the categories below are from the disorders due to substance use grouping.) 6C40.5 Alcohol-induced delirium 6C41.5 Cannabis-induced delirium 6C42.5 Synthetic cannabinoid-induced delirium 6C43.5 Opioid-induced delirium 6C44.5 Sedative, hypnotic or anxiolytic-induced delirium 6C45.5 Cocaine-induced delirium 6C46.5 Stimulant-induced delirium, including amfetamines, methamfetamine and methcathinone 6C47.5 Synthetic cathinone-induced delirium 6C49.4 Hallucinogen-induced delirium 6C4B.5 Volatile inhalant-induced delirium 6C4C.5 MDMA or related drug-induced delirium, including MDA 6C4D.4 Dissociative drug-induced delirium, including ketamine and PCP 6C4E.5 Delirium induced by other specified psychoactive substance, including medications 6C4F.5 Delirium induced by multiple specified psychoactive substances, including medications 6C4G.5 Delirium induced by unknown or unspecified psychoactive substances 6D70.2 Delirium due to multiple etiological factors 6D70.Y Delirium, other specified cause 6D70.Z Delirium, unknown or unspecified cause 6D71 Mild neurocognitive disorder 6D72 Amnestic disorder Specify identified cause: 6D72.0 Amnestic disorder due to diseases classified elsewhere 6D72.1 Amnestic disorder due to psychoactive substances, including medications Specify substance class: 6D72.10 Amnestic disorder due to use of alcohol 6D72.11 Amnestic disorder due to use of sedatives, hypnotics or anxiolytics",
  "gloss_vi": "80 clinical descriptions and diagnostic requirements for icd-11 mental, behavioural or neurodevelopmental disorders paraphilic disorders 6d30 exhibitionistic disorder 6d31 voyeuristic disorder 6d32 paedophilic disorder 6...",
  "source": "WHO ICD-11",
  "url": "https://icd.who.int/",
  "lang": "en",
  "axes": {
    "type": [
      "clinical"
    ],
    "condition": [
      "General"
    ],
    "clinical_section": [
      "management"
    ],
    "life_topics": [],
    "advice_section": [],
    "audience": [],
    "risk_band": "low"
  },
  "index_text": "General — Management General — Management 80 Clinical Descriptions and Diagnostic Requirements for ICD-11 Mental, Behavioural or Neurodevelopmental Disorders Paraphilic disorders 6D30 Exhibitionistic disorder 6D31 Voyeuristic disorder 6D32 Paedophilic disorder 6D33 Coercive sexual sadism disorder 6D34 Frotteuristic disorder 6D35 Other paraphilic disorder involving non-consenting individuals 6D36 Paraphilic disorder involving solitary behaviour or consenting individuals 6D3Z Paraphilic disorder, unspecified Factitious disorders 6D50 Factitious disorder imposed on self 6D51 Factitious disorder imposed on another 6D5Z Factitious disorder, unspecified List of categories 81 Neurocognitive disorders 6D70 Delirium Specify identified cause: 6D70.0 Delirium due to disease classified elsewhere 6D70.1 Delirium due to psychoactive substances, including medications Specify substance class: (Note: the categories below are from the disorders due to substance use grouping.) 6C40.5 Alcohol-induced delirium 6C41.5 Cannabis-induced delirium 6C42.5 Synthetic cannabinoid-induced delirium 6C43.5 Opioid-induced delirium 6C44.5 Sedative, hypnotic or anxiolytic-induced delirium 6C45.5 Cocaine-induced delirium 6C46.5 Stimulant-induced delirium, including amfetamines, methamfetamine and methcathinone 6C47.5 Synthetic cathinone-induced delirium 6C49.4 Hallucinogen-induced delirium 6C4B.5 Volatile inhalant-induced delirium 6C4C.5 MDMA or related drug-induced delirium, including MDA 6C4D.4 Dissociative drug-induced delirium, including ketamine and PCP 6C4E.5 Delirium induced by other specified psychoactive substance, including medications 6C4F.5 Delirium induced by multiple specified psychoactive substances, including medications 6C4G.5 Delirium induced by unknown or unspecified psychoactive substances 6D70.2 Delirium due to multiple etiological factors 6D70.Y Delirium, other specified cause 6D70.Z Delirium, unknown or unspecified cause 6D71 Mild neurocognitive disorder 6D72 Amnestic disorder Specify identified cause: 6D72.0 Amnestic disorder due to diseases classified elsewhere 6D72.1 Amnestic disorder due to psychoactive substances, including medications Specify substance class: 6D72.10 Amnestic disorder due to use of alcohol 6D72.11 Amnestic disorder due to use of sedatives, hypnotics or anxiolytics 80 clinical descriptions and diagnostic requirements for icd-11 mental, behavioural or neurodevelopmental disorders paraphilic disorders 6d30 exhibitionistic disorder 6d31 voyeuristic disorder 6d32 paedophilic disorder 6..."
}